id,title,audience,poster_url,genres,open_date,actors,director,description,video_key
2258,타임 패러독스,64837,https://movie-phinf.pstatic.net/20141231_157/14200021567358eDYB_JPEG/movie_image.jpg,"[2, 12]",2015-01-07,"[1218, 1775, 1776]","마이클 스피어리그,피터 스피어리그","뉴욕을 초토화시킨 폭파 사건으로 대규모 사상자가 발생한다. 용의자 피즐 폭파범을 잡기 위해 범죄 예방 본부는 시간여행을 할 수 있는 템포럴 요원을 투입한다.  단서1. 템포럴 요원은 피즐 폭파범을 막다가 얼굴을 다쳐 이식수술을 한다.  단서2. 템포럴 요원은 바텐더로 위장 취업해 존을 만난다.  단서3. 존은, 고아원에서 자라나 우주비행사를 꿈꾸다가 의문의 남자를 만나 아이를 낳고 인생을 망친 소녀 제인에 대한 이야기를 한다.  단서4. 존은 제인과 깊은 관련이 있다.  단서5. 템포럴 요원은 존을 제인이 의문의 남자를 만나기 바로 직전으로 데리고 간다.  단서6. 템포럴 요원은 존과 깊은 관련이 있다.  이제부터의 이야기를 당신은 상상도 못할 것이다!",jCt28yBWx7g
1561,극장판 안녕 자두야,213743,https://movie-phinf.pstatic.net/20190118_170/1547778023255pcghN_JPEG/movie_image.jpg,[5],2016-05-04,"[275, 456, 932, 16, 933, 808]",손석우,"자두의 판타스틱 동화나라 평정기!  대한민국 국민 절친! 명랑소녀 최자두!  [자두렐라], [자두와 그레텔]  명작동화 주인공이 된 자두의 동화나라 평정기가 시작된다!  어린이날을 맞아 가족들과 함께  놀이공원 ‘꿈의 랜드’로 놀러 가게 된 천방지축 최자두.  동생들과 신나게 놀이기구를 타던 자두는 급히 화장실을 찾게 되고,  우연히 들어가게 된 건물에서 오래된 책을 한 권 꺼내들게 된다.  그런데 동화책을 펼치는 순간!  알 수 없는 빛과 함께 자두는 책 속으로 빨려 들어가게 되는데...  어린이날, 꿈의 랜드에서 마법 같은 여정이 시작된다!",
2168,드래곤 블레이드,39439,https://movie-phinf.pstatic.net/20181217_221/1545009319914KErXj_JPEG/movie_image.jpg,"[3, 10, 1]",2015-03-12,"[802, 1718, 1719, 1720, 1721]",이인항,"2000년 전, 거대한 모래폭풍이 휘몰아치는 혼란의 땅 실크로드. 평화 유지를 위해 그곳을 지키는 부대의 총사령관 후오 안(성룡)은 어느 날 정교하게 짜인 갑옷과 붉은 갈기가 장식된 투구를 쓴 지금껏 볼 수 없었던 무기와 전투 편대를 구축하고 있는 로마 군대와 맞닥뜨리게 된다. 후오 안(성룡)은 로마 군대를 이끄는 루시우스 장군(존 쿠삭)과 피할 수 없는 결투를 하게 되지만 각각 자국에서 반역죄의 누명을 쓰게 된 사연을 알게 되면서 서로에게 존경심과 우정을 느낀다. 한편, 이들을 둘러싸고 닥쳐오는 위협은 점점 더 커져만 가고 결국 그들은 조국과 명예를 위해 목숨을 건 마지막 전투를 준비하게 되는데…",
2105,약장수,27559,https://movie-phinf.pstatic.net/20150312_166/1426123741868Er1Ay_JPEG/movie_image.jpg,[],2015-04-23,"[369, 242, 1675]",조치언,"대리운전, 일용직 등을 전전하던 일범에게 신용불량자라는 딱지는 번번이 그의 발목을 잡는 족쇄다. 아픈 딸의 치료비를 위해 어머니들에게 각종 건강식품과 생활용품을 파는 홍보관 ‘떴다방’에 취직한 일범은 자신의 처지가 한심하다. 그런 그에게 홍보관 점장 철중은 “우리가 자식보다 낫다”며 당장 처자식 먹여 살리려면 목숨 걸고 팔라 한다. 그의 말처럼 오히려 즐거워하는 어머니들을 보며 일범 역시 보람을 느끼기 시작하고 그러던 중, 자랑스런 검사 아들을 뒀지만 자식에게 짐이 되기 싫어서 홀로 외로이 노년을 보내던 옥님이 홍보관을 찾아와 일범을 만나게 되는데...",
1348,죽여주는 여자,43974,https://movie-phinf.pstatic.net/20181002_237/1538466486571MevdC_JPEG/movie_image.jpg,[10],2016-10-06,[64],샘 로,"종로 일대에서 노인들을 상대하며 근근이 살아가는 65세의 ‘박카스 할머니’ 소영. 노인들 사이에서는 ‘죽여주게 잘 하는’ 여자로 입 소문을 얻으며 박카스들 중에서 가장 인기가 높다. 트랜스젠더인 집주인 티나, 장애를 가진 가난한 성인 피규어 작가 도훈, 성병 치료 차 들른 병원에서 만나 무작정 데려온 코피노 소년 민호 등 이웃들과 함께 힘들지만 평화로운 나날을 보내던 중, 한 때 자신의 단골 고객이자, 뇌졸중으로 쓰러진 송노인으로부터 자신을 죽여달라는 간절한 부탁을 받고 죄책감과 연민 사이에서 갈등하다 그를 진짜 '죽여주게' 된다. 그 일을 계기로 사는 게 힘들어 죽고 싶은 고객들의 부탁이 이어지고, 소영은 더 깊은 혼란 속에 빠지게 된다.",
2027,소수의견,10370,https://movie-phinf.pstatic.net/20150612_150/1434091400548KK048_JPEG/movie_image.jpg,"[10, 9]",2015-06-24,"[219, 218, 711]",김성제,"“피고는 경찰이 아들을 죽였다고 하고,  검사는 철거용역이라고 한다  원고 국민, 피고 대한민국을 상대로 진실을 묻다!”  지방대 출신, 학벌 후지고, 경력도 후진 2년차 국선변호사 윤진원(윤계상). 강제철거 현장에서 열여섯 살 아들을 잃고, 경찰을 죽인 현행범으로 체포된 철거민 박재호(이경영)의 변론을 맡게 된다. 그러나 구치소에서 만난 박재호는 아들을 죽인 건 철거깡패가 아니라 경찰이라며 정당방위에 의한 무죄를 주장한다.  변호인에게도 완벽하게 차단된 경찰 기록, 사건을 조작하고 은폐하려는 듯한 검찰, 유독 이 사건에 관심을 갖고 접근해오는 신문기자 수경(김옥빈). 진원은 단순한 살인 사건이 아님을 직감하고, 선배인 이혼전문 변호사 대석(유해진)에게 사건을 함께 파헤칠 것을 제안한다.  경찰 작전 중에 벌어진, 국가가 책임져야 할 살인사건, 진압 중에 박재호의 아들을 죽인 국가에게 잘못을 인정 받기 위해 진원과 대석은, 국민참여재판 및 ‘100원 국가배상청구소송’이라는 과감한 선택을 하는데…",
3620,스노우 화이트 앤 더 헌츠맨,72016,https://movie-phinf.pstatic.net/20160404_180/1459736588298lka1y_JPEG/movie_image.jpg,"[1, 6, 10]",2012-05-30,"[3, 326, 195, 1002]",세딕 니콜라스 트로얀,"절대악의 힘으로 어둠의 세계를 건설한 ‘이블 퀸’(샤를리즈 테론), 영원한 지배자가 되기 위해서는 자신을 능가할 운명을 지닌 ‘스노우 화이트’(크리스틴 스튜어트)를 없애야 한다는 예언을 받는다.  저주가 걸린 어둠의 숲으로 사라진 ‘스노우 화이트’를 죽이기 위해 왕비는 뛰어난 전사 ‘헌츠맨’(크리스 햄스워스)을 고용한다. 하지만 어둠에 지배를 받고 있는 세계를 구원할 유일한 존재가 ‘스노우 화이트’라는 것을 알게 된 ‘헌츠맨’은 ‘이블 퀸’을 배신하고 ‘스노우 화이트’의 편에 선다.  ‘이블 퀸’에게 맞서 세계를 구할 결심을 한 ‘스노우 화이트’는 최강의 전사 ‘헌츠맨’과 강인한 드워프 족 그리고 신비한 능력을 지닌 정령들의 도움을 받아 빛의 군대를 만들고 ‘이블 퀸’에게 빼앗긴 세계를 되찾기 위한 거대한 전쟁을 시작하는데…",
2711,폼페이: 최후의 날,542999,https://movie-phinf.pstatic.net/20140213_66/13922550578607kpLm_JPEG/movie_image.jpg,"[3, 1, 15, 14, 10]",2014-02-20,"[181, 1983, 1984, 1985]",폴 앤더슨,"어릴 적 로마 군에 의해 가족을 모두 잃은 뒤 노예 검투사가 된 ‘마일로’(킷 해링턴)는 폼페이 영주의 딸 ‘카시아’(에밀리 브라우닝)와 운명적인 사랑에 빠지게 된다. 풍요를 기원하는 비날리아 축제의 대규모 검투 경기에 참여한 ‘마일로’는 자신의 부모를 죽인 ‘코르부스’(키퍼 서덜랜드)를 발견한다. 로마의 상원 의원이 된 ‘코르부스’는 ‘카시아’와 정략 결혼을 계획하고, ‘마일로’는 부모의 복수와 자신의 연인을 지켜내기 위해 목숨을 건 최후의 검투에 나선다. 그 순간 갑자기 폭발을 시작하는 베수비오 화산! 도망칠 새도 없이 쏟아지는 뜨거운 용암과 화산재에 폼페이는 순식간에 무너져 내리는데…",
2609,역린,1697086,https://movie-phinf.pstatic.net/20140404_158/13965930899877qfjc_JPEG/movie_image.jpg,"[3, 10]",2014-04-30,"[335, 198, 206, 1298, 352]",이재규,"인시(寅時) 정각(오전 3시)  ‘과인은 사도세자의 아들이다.’ 정조 1년, 끊임없는 암살 위협에 시달리며 밤에도 잠을 이루지 못하는 정조(현빈). 정조가 가장 신임하는 신하 상책(정재영)은 그의 곁을 밤낮으로 그림자처럼 지킨다.  인시(寅時) 반각(오전 4시)  날이 밝아오자 할마마마 정순왕후에게 아침 문안인사를 위해 대왕대비전으로 향하는 정조. 왕의 호위를 담당하는 금위영 대장 홍국영(박성웅)과 상책이 그의 뒤를 따른다.  묘시(卯時) 정각(오전 5시)  ‘주상이 다치면 내가 강녕하지 않아요.’ 노론 최고의 수장인 정순왕후(한지민)는 넌지시 자신의 야심을 밝히며 정조에게 경고한다.  묘시(卯時) 반각(오전 6시)  정조의 처소 존현각에는 세답방 나인 월혜(정은채)가 의복을 수거하기 위해 다녀가고, 정조의 어머니 혜경궁(김성령)이 찾아와 ‘지난 밤 꿈자리가 흉했다’며 아들의 안위를 걱정한다.  진시(辰時) 육각(오전 8시 30분)  한편 궐 밖, 조선 최고의 실력을 지닌 살수(조정석)는 오늘 밤 왕의 목을 따오라는 광백(조재현)의 암살 의뢰를 받게 되는데…  왕의 암살을 둘러싸고 살아야 하는 자, 죽여야 하는 자, 살려야 하는 자들의  엇갈린 운명의 24시가 시작된다!",
3178,호프 스프링즈,31767,https://movie-phinf.pstatic.net/20130321_185/1363829183105lqOp5_JPEG/movie_image.jpg,"[10, 4, 14]",2013-04-04,"[418, 1263, 870]",데이빗 프랭클,"일주일만에 짜릿한 신혼으로...? 의 데이빗 프랭클 감독과 메릴 스트립이 선사하는 솔직∙화끈한 연애힐링코미디!",
1987,다크 플레이스,51192,https://movie-phinf.pstatic.net/20150707_126/1436246947798VhHJM_JPEG/movie_image.jpg,"[10, 7, 12]",2015-07-15,"[326, 1241, 1429, 1607]",질스 파겟 브레너,"라일의 추리 탐정 클럽, 킬 클럽에서 활동하고 있는 라일(니콜라스 홀트)은 25년 전 큰 아들 벤이 엄마와 어린 여동생 2명을 잔혹하게 살해한 사건에 의구심을 갖게 되고 유일한 생존자이자 증인, 막내 리비(샤를리즈 테론)를 찾게 된다. 리비의 기억 오빠 벤이 엄마와 언니들을 잔혹하게 살해한 사건의 유일한 목격자. 아직도 어린 시절의 충격에서 벗어나지 못한 리비에게 어느 날 라일이란 사람이 25년 전 사건에 미심쩍은 부분이 있다며 그녀를 찾아온다. 경제적으로 어려움을 겪고 있던 리비는 돈을 받는 조건으로 그 날의 끔찍한 기억을 되짚어 보는데 …  벤의 그 날 유일한 친구인 트레이와 디온드라(클로이 모레츠)는 마약 중독에 사탄을 숭배한다. 25년 전 그 날, 벤은 마을에서 변태로 낙인 찍혔고, 친구들의 마약공급자가 아빠 러너임을 알게 되어 충격에 휩싸인다. 인생 최악의 날을 보낸 벤은 새벽 1시 마약에 취한 채로 여자친구 디온드라와 함께 가족 모두가 잠든 집으로 향하게 되는데 … 25년 전, 엄마와 언니들이 살해되던 밤,  그 곳에 오빠 그리고 다른 누군가 있었다",
4362,쓰리 데이즈,159669,https://movie-phinf.pstatic.net/20180417_278/1523951973965zx8pa_JPEG/movie_image.jpg,"[14, 10, 12, 9]",2010-12-22,[64],공영청,"종신형에 처한 아내. 법이 구할 수 없다면 내가 하겠다! 행복한 가정을 이루며 살고 있던 ‘존(러셀 크로우)’의 가정에 불어 닥친 위기!  어느 날 갑자기 아내 ‘라라(엘리자베스 뱅크스)’가 살해혐의로 경찰에 잡혀가게 된다.  종신형에 처하게 된 아내의 무죄를 입증하기 위해 ‘존’은 온갖 노력을 다해보지만,  모든 증거와 법적 정황은 그녀에게 불리하기만 하다. 절망감에 빠진 ‘라라’는 자살을 시도하고,  ‘존’은 결국 아내를 살리기 위해, 그녀를 탈옥시키겠다는 결심을 한다.  주어진 시간은 단 3일. 불가능한 5가지 미션… 아내를 탈옥시키기 위한 처절한 사투가 시작된다! 전설적인 탈옥의 대가 ‘데이먼(리암 니슨)’을 찾아가 탈옥에 성공할 수 있는 5가지 미션을 전수받는 ‘존’!  교도소 이송조치로 아내를 구할 수 있는 시간은 단 3일뿐. 도저히 불가능해 보이는 미션을 완수하고 35분 안에 도시를 탈출해야 한다.  자신의 목숨을 잃을지도 모르는 위험 속에서 과연 그는 아내를 탈옥시키고 살아나갈 수 있을까……",
1400,라이트 아웃,534423,https://movie-phinf.pstatic.net/20160725_249/1469408792231AYlvh_JPEG/movie_image.jpg,"[12, 7, 13]",2016-08-24,"[1023, 865, 1264, 1265]",데이비드 F. 샌드버그,"불이 꺼지면 나타나는 누군가를 목격한 남매 레베카와 마틴. 알고보니 어둠 속 그 여자는 빛이 닿으면 피부가 타들어가는 기이한 병을 앓고 있던 엄마의 어릴적 친구 '다이애나'였고, 현재도 엄마 곁에서 함께 살고 있다는 걸 알게 되는데…",
1424,국가대표 2,407063,https://movie-phinf.pstatic.net/20160810_259/1470790761456d04zP_JPEG/movie_image.jpg,[10],2016-08-10,"[415, 685, 649]",김종현,"유일무이 정통 아이스하키 선수 출신 에이스 '지원'  자존심은 금메달 급, 현실은 쇼트트랙 강제퇴출 '채경'  사는 게 심심한 아줌마, 빙판에선 열정의 프로 '영자'  시간외 수당이 목표, 아이스하키협회 경리 출신 '미란'  취집으로 인생 반전 꿈꾸는 전직 피겨요정 '가연'  주장 급 멘탈 보유자, 최연소 국가대표 꿈나무 '소현'  말만 번지르르, 주니어 아이스하키 우정상에 빛나는 국대 출신 감독 '대웅'  이들이 뭉친 단 하나의 이유는 아오모리 동계 아시안 게임 출전!  출신불문, 경험부족, 능력제로  한 팀이 되는 것 자체가 도전이었던 이들에게 다가온 차가운 현실은  그저 동계 올림픽 유치를 위한 병풍 취급뿐이다  뭉치면 싸우고 흩어지면 출전불가!  모두가 불가능하다고 믿었던 이들의 뜨거운 도전이 시작된다!",8i7kGLv9pDQ
2593,트랜센던스,420321,https://movie-phinf.pstatic.net/20140508_286/1399516260430nO8Ry_JPEG/movie_image.jpg,"[12, 2, 10, 7]",2014-05-14,"[312, 1277, 290]",월리 피스터,"인류가 수억 년에 걸쳐 이룬 지적능력을 초월하고 자각능력까지 가진 슈퍼컴 ‘트랜센던스’의 완성을 목전에 둔 천재 과학자 ‘윌’(조니 뎁)은 기술의 발전은 인류의 멸망이라 주장하는 반(反) 과학단체 ‘RIFT’의 공격을 당해 목숨을 잃는다. 연인 ‘에블린’(레베카 홀)은 윌의 뇌를 컴퓨터에 업로드 시켜 그를 살리는데 성공하지만, 또 다른 힘을 얻은 그는 온라인에 접속해 자신의 영역을 전 세계로 넓혀가기 시작하는데…",
230,투 프렌즈,20419,https://movie-phinf.pstatic.net/20181105_273/1541398692776XWwyH_JPEG/movie_image.jpg,"[4, 14, 10]",2018-11-29,"[164, 167, 169, 166, 165, 325]",빅터 아즈에프,"세계적 명성의 셀러브리티와 미녀 스타들을 취재하는 뉴욕 초일류 연예잡지 ‘샤프스’. 편집장 클레이튼 하들링은 영국의 괴팍한 연예기자 시드니 영을 스카우트 하지만, 직장 동료 앨리슨은 그가 한심하기만 하다. 그 사이... 떠오르는 섹시 스타 소피 메이즈는 여우주연상을 받게 되면 그와 잠자리를 하겠다는 약속을 하고 시드니는 그녀의 매니저 엘레노어와 함께 ‘샤프스’ 매거진을 활용한 그녀의 이미지 메이킹에 동참하게 되는데… 과연 시드니는 뉴욕에서 최고의 기자로 성공할 수 있을까? 여배우와 하룻밤은 성공할까?",
3784,하이힐을 신고 달리는 여자,40246,https://movie-phinf.pstatic.net/20111226_257/1324864775781FUl82_JPEG/movie_image.jpg,"[14, 4]",2012-02-02,"[2403, 419, 2404]",더글러스 맥그라스,"까지고! 걸리고! 넘어져도!  포기할 수 없는 10cm 위 세상을 향한 전력질주가 시작된다! 롤러코스터 타듯 정신 없는 나날을 보내는 펀드 매니저 케이트. 그녀에게 사람들은 “어떻게 그 많은 일들을 다 해내는지 몰라?!”라며 감탄을 금치 못한다. 어느 날, 뉴욕 본사 글로벌 프로젝트가 주어지고, 자신의 능력을 인정해주며 호의를 베푸는 매력적인 클라이언트를 만나게 된다. 훈남과 함께 커리어도 높일 수 있는 일생일대의 찬스! 과연, 그녀는 그 많은 일들을 다 해낼 수 있을까?",
742,기억의 밤,569748,https://movie-phinf.pstatic.net/20171129_172/1511930306592dumMz_JPEG/movie_image.jpg,"[12, 7]",2017-11-29,"[747, 471]",장항준,"새 집으로 이사 온 날 밤, 정체불명의 괴한들에게 납치된 형 유석. 동생 진석은 형이 납치된 후 매일 밤 환청과 환각에 시달리며 불안해한다. 납치된지 19일째 되는 날 돌아온 유석은 그동안의 모든 기억을 잃었다고 말한다. 하지만 돌아온 뒤로 어딘가 변해버린 유석을 의심하던 진석은 매일 밤 사라지는 형을 쫓던 중 충격적인 사실과 마주하게 되는데...",
4236,킹스 스피치,259457,https://movie-phinf.pstatic.net/20111223_101/1324632551480Ysz2q_JPEG/movie_image.jpg,"[10, 15]",2011-03-17,"[421, 929, 518]",톰 후퍼,"연합군의 비밀무기는 말더듬이 영국 왕?! 세상을 감동시킨 국왕의 콤플렉스 도전이 시작된다!  때는 1939년, 세기의 스캔들을 일으키며 왕위를 포기한 형 때문에 본의 아니게 왕위에 오른 버티. 권력과 명예, 모든 것을 다 가진 그에게도 두려운 것이 있었으니 바로 마.이.크! 그는 사람들 앞에 서면 ""더더더..."" 말을 더듬는 콤플렉스를 가졌던 것! 국왕의 자리가 버겁기만 한 버티와 그를 지켜보는 아내 엘리자베스 왕비, 그리고 국민들도 애가 타기는 마찬가지… 게다가 지금 세계는 2차 세계 대전중! 불안한 정세 속 새로운 지도자를 간절히 원하는 국민들을 위해 버티는 아내의 소개로 괴짜 언어 치료사 라이오넬 로그를 만나게 되고, 삐걱거리는 첫 만남 이후 둘은 기상천외한 치료법을 통해 말더듬증 극복에 도전하게 되는데…",
2467,비긴 어게인,102576,https://movie-phinf.pstatic.net/20150102_205/1420184706539aXIMb_JPEG/movie_image.jpg,"[4, 16, 14, 10]",2014-08-13,"[1847, 1848, 1849, 1850, 1851]",차준호,"싱어송라이터인 그레타(키이라 나이틀리)는 남자친구 데이브(애덤 리바인)가 메이저 음반회사와 계약을 하게 되면서 뉴욕으로 오게 된다. 그러나 행복도 잠시, 오랜 연인이자 음악적 파트너로서 함께 노래를 만들고 부르는 것이 좋았던 그레타와 달리 스타가 된 데이브의 마음은 어느새 변해버린다. 스타 음반프로듀서였지만 이제는 해고된 댄(마크 러팔로)은 미치기 일보 직전 들른 뮤직바에서 그레타의 자작곡을 듣게 되고 아직 녹슬지 않은 촉을 살려 음반제작을 제안한다. 거리 밴드를 결성한 그들은 뉴욕의 거리를 스튜디오 삼아 진짜로 부르고 싶었던 노래를 만들어가는데...",
1607,비포 선라이즈,21832,https://movie-phinf.pstatic.net/20171019_36/1508391704967HDTSm_JPEG/movie_image.jpg,"[10, 14]",1996-03-30,[64],김병준,"파리로 돌아가는 셀린과 비엔나로 향하는 제시.  기차 안에서 우연히 만난 그들은 짧은 시간에 서로에게 빠져든다.  “나와 함께 비엔나에 내려요”  그림 같은 도시와 꿈같은 대화 속에서 발견한  서로를 향한 강한 이끌림은 풋풋한 사랑으로 물들어 간다.  밤새도록 계속된 그들의 사랑 이야기 끝에  해가 떠오르기 시작하고 그들은 헤어져야만 하는데…  단 하루, 사랑에 빠지기 충분한 시간  낭만적인 로맨스가 다시 피어오른다.",
2091,위험한 상견례 2,211159,https://movie-phinf.pstatic.net/20150415_257/1429075626914yLhHW_JPEG/movie_image.jpg,"[14, 4]",2015-04-29,"[1269, 1656, 1657, 1658, 1659]",김진영,"은퇴를 앞둔 강력반 형사 아빠,  과학수사팀 리더 큰 언니, 경찰대학 교수 형부, 강력반 형사 둘째 언니, 온 가족이 경찰공무원인 집안의 막내,  전직 국가대표 펜싱선수이자 강남경찰서 마약 3팀 팀장 영희. … 7년 째 경찰고시생 남친 뒷바라지 중.  古(고)문화재 전문털이범 아빠, 각종 문서 위조 전문가 엄마  온 가족이 지명수배자인 집안의 귀한 외아들로 천재적 범죄성의 강점만을 물려받은 철수. … 7년 째 경찰공무원 시험 준비 중.  공직생활 동안 평생 쫓던 지명수배자의 아들은 사위로는 절대 안돼!  VS 철두철미한 방해공작(?)! 내 자식을 절대 경찰이 되게 할 수 없어!",
1783,극적인 하룻밤,180126,https://movie-phinf.pstatic.net/20151103_138/1446524904404zf9yt_JPEG/movie_image.jpg,"[14, 4]",2015-12-03,"[219, 566, 54, 1492]",하기호,"각자 전 애인 결혼식장에서 만난 정훈(윤계상)과 시후(한예리). 술잔을 기울이며 실연의 고통을 함께 나누던 두 사람은 몸까지 나누는 극적인 하룻밤을 보내고 만다. 하지만 이대로 끝내기엔 너무나 기막혔던 하룻밤!  “딱 몸친, 거기까지만. 열 개 다 채우고 빠이빠이. 어때?”  시후는 커피 쿠폰 10개 채울 때까지, 딱 아홉 번만 더 자자는 당돌한 제안을 하고, 속타는 연애에 지친 연애 ‘을(乙)’ 정훈과 시후의 ‘섹’다른 만남이 시작된다. 하지만 쿠폰 도장이 늘어갈수록 두 사람의 마음은 미묘해 지고, 시후의 전 남친 준석(박병은)은 자꾸 시후 곁을 맴돌며 정훈(윤계상)의 심기를 건드린다.  연애 ‘을(乙)’ 정훈과 시후, 원나잇 쿠폰 열 번 찍고 약속대로 쿨하게 굿바이 할 수 있을까?",
2810,집으로 가는 길,821365,https://movie-phinf.pstatic.net/20180814_245/15342339351388JxwX_JPEG/movie_image.jpg,[10],2013-12-11,[64],키야마 미즈키,"“저는… 집으로 가고 싶습니다”  사랑하는 남편과 딸이 세상 전부인 평범한 아내.  여권에 처음 도장이 찍히던 날, 그녀는 프랑스에서 마약범으로 몰려 교도소에 수감된다.  한국에서 비행기로 22시간, 대서양 건너 12,400km 지구 반대편 프랑스 외딴 섬 마르티니크 교도소..  말도 한마디 통하지 않는 낯선 곳... 그녀는 집으로 돌아갈 수 있을까?  ""제발.. 제 아내를 돌려 보내주세요.”  사랑하는 아내와 딸이 세상 전부인 평범한 남편.  그는 친구의 배신으로 집과 어렵사리 마련한 가게 그리고 아내마저 잃었다.  생활비를 벌기 위해 가이아나에서 프랑스로 원석을 운반한 아내. 그러나 그것은 마약이었다.  한국에서 비행기로 22시간, 대서양 건너 12,400km 지구 반대편 프랑스 외딴 섬 마르티니크 교도소..  지도에서도 찾기 힘든 머나먼 곳... 그는 아내를 되찾을 수 있을까?",
2129,분노의 질주: 더 세븐,1170353,https://movie-phinf.pstatic.net/20150327_289/1427423961867dqf2C_JPEG/movie_image.jpg,"[3, 9, 12]",2015-04-01,"[954, 1673, 480, 439, 1674]",제임스 완,"도미닉(반 디젤)과 멤버들은 범죄조직 소탕 후 모든 전과를 사면 받고 평범한 일상으로 돌아간다. 하지만 평화도 잠시, 전작에서 처리한 범죄조직의 리더 오웬 쇼의 형 데카드 쇼(제이슨 스타뎀)가 동생의 복수를 위해 멤버들을 차례로 공격한다. 특수부대 출신 용병 데카드 쇼의 난입으로 한(성 강)이 갑작스레 사망하게 되고, 도미닉의 집은 순식간에 폭파당한다. 이에 맞서는 정부요원 페티(커트 러셀)는 도미닉을 돕는 조건으로 납치당한 해커 램지(나탈리 엠마누엘)의 구출을 의뢰하고, 도미닉은 멤버들을 다시 모아 숨막히는 반격을 시작한다.",
1825,더 셰프,124901,https://movie-phinf.pstatic.net/20151023_229/1445577125274clYXx_JPEG/movie_image.jpg,[11],2015-11-05,"[122, 832, 1516, 1517, 1518, 1519, 1520, 656]",존 웰스,"Supermensch는 LA에서 대학을 졸업 한 후 우연히 음악 감독직에 합류 한 Shep Gordon과 할리우드 내부자의 놀라운 경력을 기록하고 Janis Joplin, Jim Morrison 및 Jimi Hendrix와 친분을 쌓습니다. Shep는 Pink Floyd, Luther Vandross, Teddy Pendergrass, Alice Cooper와 같은 록 스타를 관리했으며 이후 Emeril Lagasse와 같은 요리사를 관리하여 TV의 유명 요리사 시대를 열었습니다. (구글번역)",
