id,title,audience,poster_url,genres,open_date,actors,director,description,video_key
3201,파파로티,453480,https://movie-phinf.pstatic.net/20130228_105/1362026575599uE2wA_JPEG/movie_image.jpg,[],2013-03-14,"[95, 791, 685, 171, 304, 2188]",윤종찬,"한 때 잘 나가던 성악가였지만 지금은 촌구석 예고의 음악 선생인 상진(한석규). 싸늘한 교육열, 까칠함만 충만한 그에게 청천벽력 같은 미션이 떨어진다. 천부적 노래 실력을 지녔으나, 일찍이 주먹세계에 입문한 건달 장호(이제훈)를 가르쳐 콩쿨에서 입상 하라는 것. 전학 첫날 검은 승용차에 어깨들까지 대동하고 나타난 것도 모자라, 수업 중에도 ‘큰 형님’의 전화는 꼭꼭 챙겨 받는 무늬만 학생인 장호가 못마땅한 상진. 장호의 노래를 들어볼 필요도 없이 결론을 내린다.  주먹과 노래 두 가지 재능을 타고났으나 막막한 가정 환경으로 인해 주먹 세계에 뛰어든 장호. 비록 현실은 ‘파바로티’의 이름 하나 제대로 모르는 건달이지만 성악가가 되고픈 꿈만은 잊은 적 없다. 이런 자신을 가르쳐 주긴커녕 툭하면 개나 소나 취미로 하는 게 클래식이냐며 사사건건 무시하는 쌤 상진의 태도에 발끈하는 장호. 그래도 꿈을 포기할 수 없는 장호는 험난하고 까칠한 상진과의 관계를 이어가는데...",OEVGLuzM2z0
491,독전,1812738,https://movie-phinf.pstatic.net/20180524_197/1527129752646aGAH7_JPEG/movie_image.jpg,"[9, 3]",2018-05-22,"[304, 205, 482, 483, 94]",이해영,"아시아 최대 마약 조직 산하에 있는 마약 제조 공장에서 의문의 폭발 사고가 발생한다. 목숨을 잃을 뻔했던 조직의 후견인 연옥(김성령)은 배신감을 느끼고, 조직의 수장 이 선생을 오랫동안 쫓아왔던 형사 원호(조진웅)를 직접 찾아가 중요한 정보를 흘린다. 유일한 생존자였던 락(류준열)은 조직으로부터 버림받은 후 원호의 수사에 적극적으로 협조하기로 한다. 두 사람은 이 선생과 거래를 할 예정이었던 진하림(김주혁)과 헌신적인 조직원 선창(박해준) 사이를 오가며 이 선생의 실체에 조금씩 다가간다. 그리고 원호와 락 앞에 거물급 조직 인사 브라이언(차승원)이 모습을 드러낸다.",QKWlXvt9x7c
3999,콜롬비아나,302098,https://movie-phinf.pstatic.net/20111223_189/13246424230644zzKN_JPEG/movie_image.jpg,"[3, 12, 9, 10]",2011-08-31,"[525, 2474]",올리비에 메가턴,"암흑조직에게 부모를 잃고 홀로 살아남은 9살 소녀 ‘카탈리아’. 그 날 이후, 그녀는 킬러인 삼촌 밑에서 완벽한 복수를 준비해 간다. 치명적인 매력과 스마트한 두뇌, 그리고 프로페셔널한 실력을 갖춘 여전사로 성장한 ‘카탈리아’는 부모의 죽음과 관계된 인물들을 하나씩 처단하고 암흑조직과 FBI, 모두의 표적이 된다.",
2790,용의자,1827610,https://movie-phinf.pstatic.net/20180411_99/1523430085223y8oKC_JPEG/movie_image.jpg,"[3, 12]",2013-12-24,"[2006, 2007, 2008]",소유붕,"조국에게 버림받고 가족까지 잃은 채 남한으로 망명한  최정예 특수요원 ‘지동철’(공유).  그의 목표는 단 하나, 아내와 딸을 죽인 자를 찾는 것뿐이다.  놈의 행적을 쫓으며 대리운전을 하며 살아가던 동철은  유일하게 자신과 가깝게 지내던 박회장의 살해 현장을 목격하게 된다.  죽기 전 박회장이 남긴 물건을 받아 든 동철은 사건의 용의자로 지목되어 모두에게 쫓기게 된다.",
4182,써니,59731,https://movie-phinf.pstatic.net/20180618_150/1529312002172th3l2_JPEG/movie_image.jpg,[10],2011-05-04,"[2486, 2487, 2488, 463]",시라이시 카즈야,"전라도 벌교 전학생 나미는 긴장하면 터져 나오는 사투리 탓에 첫날부터 날라리들의 놀림감이 된다. 이때 범상치 않는 포스의 친구들이 어리버리한 그녀를 도와주는데… 그들은 진덕여고 의리짱 춘화, 쌍꺼풀에 목숨 건 못난이 장미, 욕배틀 대표주자 진희, 괴력의 다구발 문학소녀 금옥, 미스코리아를 꿈꾸는 사차원 복희 그리고 도도한 얼음공주 수지. 나미는 이들의 새 멤버가 되어 경쟁그룹 ‘소녀시대’와의 맞짱대결에서 할머니로부터 전수받은 사투리 욕 신공으로 위기상황을 모면하는 대활약을 펼친다. 일곱 명의 단짝 친구들은 언제까지나 함께 하자는 맹세로 칠공주 ‘써니’를 결성하고 학교축제 때 선보일 공연을 야심차게 준비하지만 축제 당일, 뜻밖의 사고가 일어나 뿔뿔이 흩어지게 된다.",
5,어글리 돌,37541,https://movie-phinf.pstatic.net/20190426_71/1556254332881AWqUn_JPEG/movie_image.jpg,"[5, 4, 8, 1, 6]",2019-05-01,"[26, 27, 28, 29, 30]",켈리 애스버리,"춤과 노래가 멈추지 않는 행복 마을 ‘어글리 빌’에 사는 사랑둥이 인싸돌 ‘모씨’는 마을 바깥에 어떤 세상이 있을지 늘 궁금해한다. 모씨는 친구 ‘어글리 독’, ‘웨이지’, ‘럭키 뱃’, ‘바보’와 함께 파이프 건너편으로 모험을 떠나기로 결심하고 외모도 성격도 너무 완벽한 ‘퍼펙션 스쿨’의 ‘루’와 ‘맨디‘를 만나 새롭고 짜릿한 세상을 경험한다! 퍼펙션 스쿨에서 최고의 애착 인형이 되기 위한 스파르타 수업에 몰두하던 이들은 인형들의 숨겨진 진실을 마주하고 마는데…",
1247,목숨 건 연애,37650,https://movie-phinf.pstatic.net/20161205_257/1480912200246MaWGU_JPEG/movie_image.jpg,"[14, 12, 4]",2016-12-14,"[1119, 1120, 1121]",송민규,"동네 사람 모두를 살인범으로 의심해 경찰은 물론 이웃들 사이에서도  이태원 민폐녀로 통하는 추리소설작가 ‘한제인’(하지원).  차기작 구성만 5년 째, 출판사에서도 포기 직전인 그녀는  이태원 연쇄살인사건을 모티브로 신작을 쓰기로 결심한다.  그러던 어느 날, 남다른 촉으로  위층에서 살인사건의 정황을 포착하게 되는데 경찰은 그녀의 말을 믿어주지 않는다.  이 참에 직접 살인범을 잡아 이태원 민폐녀에서 베스트셀러 작가로 명예회복을 결심한 제인!  이태원지구대 순경인 소꿉친구 ‘설록환’(천정명)의 전폭적인 지원과  제인의 팬이자 날카로운 추리력까지 겸비한 정체불명의 매력남 ‘제이슨’(진백림)의 도움을 얻어  본격적인 범인 추적에 나서는데…!!  연쇄살인범도 잡고, 베스트셀러 작가로 거듭나기 위한!  그녀의 기상천외한 수사가 시작된다!",QFw_YuOw39I
4,명탐정 피카츄,119718,https://movie-phinf.pstatic.net/20190424_53/1556091565705XDpwg_JPEG/movie_image.jpg,"[7, 8, 9, 6, 4, 2]",2019-05-09,"[24, 25]",롭 레터맨,"기억을 잃은 채 깨어난 피카츄, 난 누구? 여긴 어디? 유일한 단서는 탐정모자에 적힌 해리란 이름과 주소. 주소 속 아파트에서 자신의 말을 유일하게 알아 듣는, 실종된 해리의 아들 팀 굿맨을 만나게 된다. 명탐정의 촉으로 이건 그야말로 대.박.사.건! 사라진 아빠를 찾기 위해 피카츄와 떠나는 기상천외한 모험이 시작된다. 피카피카!",iY50AnMvuio
1167,50가지 그림자: 심연,109366,https://movie-phinf.pstatic.net/20170209_186/1486602690791shLj1_JPEG/movie_image.jpg,"[10, 14]",2017-02-09,"[681, 680]",제임스 폴리,"크리스찬 그레이는 아나스타샤 스틸을 잊지 못해 되찾으려고 하지만 아나스타샤는 지금까지와 다른 새로운 관계를 원한다. 과거의 상처를 고백하며 점점 변해가는 크리스찬의 모습에 아나스타샤는 결국 그를 받아들이고, 둘은 서로에게 더욱 깊이 빠져들며 뜨거운 사랑을 나눈다. 그러나 그의 숨겨진 과거와 비밀을 아는 사람들이 아나스타샤를 위협하기 시작하면서 그들의 관계는 위태로워지는데...",
3037,사이드 이펙트,23440,https://movie-phinf.pstatic.net/20180704_114/153068677835670uWy_JPEG/movie_image.jpg,"[3, 10, 12, 2]",2013-07-11,"[2142, 2143, 2144]","안드레아스 클리멘트,안드레 헤데토프트","DNA 조작으로 질병을 치료하는 연구를 담당한 에릭과 율리아. 어느 날, 청천벽력으로 에릭에게 암이 재발되고 그를 살리기 위해 연인 율리아는 DNA를 조작한 혈청을 에릭에게 주입한다. 이후 에릭은 건강해지는 걸 넘어서서 초인적인 힘을 발휘하게 되고, 그들은 엄청난 과학적 성과를 이룬 것에 대해 흥분한다. 하지만 급작스레 부작용이 나타나고 새로운 혈청을 찾기 위해 DNA 조작 연구를 가속하는 에릭과 그의 연구가 인류에게 재앙이 될 수 있다는 사실을 알게 된 율리아는 그의 위험한 실험을 멈추려고 하는데…!",
2885,배우는 배우다,85298,https://movie-phinf.pstatic.net/20130916_162/13792952909317FljK_JPEG/movie_image.jpg,[10],2013-10-24,"[1275, 337]",신연식,"READY! 알아주는 사람은 없어도 마음껏 꿈꿀 수 있었던 단역 ACTION! 주연배우 못지 않은 연기력으로 단숨에 조연으로 등극한 신인 그리고 단 한편의 영화로 폭발적인 인기를 얻으며 최정상에 올라선 주연 CUT! 다시 밑바닥 인생으로 걷잡을 수 없이 추락하는 배우...  ‘배우 탄생’의 충격적인 뒷이야기가 공개된다!",
2222,내 심장을 쏴라,273599,https://movie-phinf.pstatic.net/20150115_254/1421312888488dGqdV_PNG/movie_image.jpg,[10],2015-01-28,"[1746, 938]",문제용,"경험이 말한다! “이 녀석은 피하라고!” 어린 시절의 트라우마 때문에 6년째 병원을 제집처럼 드나든, 누구보다 성실한 모범환자 ‘수명’. 하지만 움직이는 시한폭탄 ‘승민’과 엮이면서 그의 평화로운 병원라이프가 흔들리기 시작한다. 본능이 말한다! “이 녀석, 재미있겠다고!” 이유도 없이 강제로 병원에 갇히게 된 ‘승민’. 어떻게든 이 곳을 나가야만 하는 그는 같은 방 동기이자 동갑내기인 ‘수명’을 꼬드겨 탈출을 감행한다. 세상을 상대하러 나선 놈들! 모든 것을 내던진 청춘들의 위험한 탈출이 시작된다!",
1013,노무현입니다,596691,https://movie-phinf.pstatic.net/20190403_169/1554258188558HJpR3_JPEG/movie_image.jpg,[11],2017-05-25,[922],김재희,"2002년, 새천년민주당은 정당 최초로 국민 참여 경선제를 도입하여 대통령 후보를 선출하기로 결정한다. 기라성 같은 정치인들이 경선에 뛰어든 가운데, 1995년 부산시장 선거, 1996년 15대 총선 등 출마하는 선거마다 번번이 낙선했던 만년 꼴찌 후보 노무현이 당당히 출사표를 던진다. 제주를 시작으로 전국 16개 도시에서 치러진 대국민 이벤트. 당내 입지가 거의 없던 상태에서 쟁쟁한 후보들과 엎치락뒤치락하며 제주 경선 3위, 울산 1위, 그리고 광주까지 석권한 지지율 2%의 꼴찌 후보 노무현이 전국을 뒤흔들기 시작한다.",JfUDkvdqrkg
4485,시라노; 연애조작단,1334539,https://movie-phinf.pstatic.net/20130503_213/13675682298463mBm6_JPEG/movie_image.jpg,"[14, 4]",2010-09-16,"[2660, 2661, 555, 1656, 2662]",강경훈,"100% 성공률에 도전하는 ‘시라노 에이전시’는 연애에 서투른 사람들을 대신해 연애를 이루어주는 연애조작단이다. 때로는 영화 촬영장을 방불케 하는 조직적인 움직임으로, 때로는 비밀 작전 수행처럼 완벽하게 짜여진 각본으로 의뢰인의 사랑을 이루어주는 연애 에이전시. 그들의 신조는 ‘음지에서 일하고 양지를 지향 안 한다’ 이다.  그러던 어느 날 에이전시 대표인 병훈(엄태웅 분)과 그의 작전요원 민영(박신혜 분)은 예측불허의 의뢰인 상용(최다니엘 분)을 만나게 되는데…. 스펙은 최고이나, 연애는 꽝인 2% 부족한 스펙남 상용이 사랑에 빠진 여자는 속을 알 수 없는 사랑스런 외모의 희중(이민정 분)이다. 의뢰인의 타깃녀 희중의 프로필을 본 순간, 고민에 빠진 병훈…",
1161,조작된 도시,1072450,https://movie-phinf.pstatic.net/20170206_87/1486347556947SbfPd_JPEG/movie_image.jpg,[3],2017-02-09,"[1017, 657, 959]",배종,"게임 세계 속에서는 완벽한 리더지만 현실에서는 평범한 백수인 ‘권유’(지창욱).  PC방에서 우연히 휴대폰을 찾아 달라는 낯선 여자의 전화를 받게 되고  이후, 영문도 모른 채 그녀를 잔인하게 살해한 범인으로 몰리게 된다  모든 증거는 짜맞춘 듯 권유를 범인이라 가리키고,  아무도 그의 결백을 믿어주지 않는 가운데  권유의 게임 멤버이자 초보 해커인 ‘여울’(심은경)은  이 모든 것이 단 3분 16초 동안, 누군가에 의해 완벽하게 조작되었음을 알게 된다.  특수효과 전문 ‘데몰리션’(안재홍)을 비롯 게임 멤버가 모두 모여  자신들만의 새로운 방식으로 사건의 실체를 추적해나가기 시작하고,  조작된 세상에 맞서기 위한 짜릿한 반격에 나서는데...! 살인자로 조작된 시간, 단 3분 16초  그들이 짜놓은 세상, 우리가 뒤집는다!",
3176,호스트,34828,https://movie-phinf.pstatic.net/20190515_274/1557904371304DfmMz_JPEG/movie_image.jpg,"[3, 1, 14, 2, 12]",2013-04-04,[2199],노보리토 잇폰스기,"생명체의 뇌에 들어가 기생해 사는 외계생명체 ‘소울’에 의해 거의 모든 인간이 정복당한 미래.  감정을 빼앗기지 않은 단 한명의 인간 멜라니에게 소울들은 그들 중 가장 경험이 많고 뛰어난 정신력을 가진 완다를 집어 넣는다. 하지만 완다는 이미 사라졌어야 할 멜라니의 영혼과 마주하고, 멜라니의 강력한 의지와 처음 겪는 다양한 감정에 괴로워한다. 멜라니는 자신의 육체를 지배한 완다에게 맞서며 헤어졌던 가족과 연인에게로 그녀를 이끈다. 멜라니의 모습을 한 완다는 마침내 멜라니의 연인 제라드를 만나게 되고, 그 곳에서 또 다른 인연 이안을 만나 호감을 느끼게 되는데….  한 몸에 존재하는 두 개의 영혼, 인류의 마지막이 그녀에게 달렸다!",
3944,히트,29800,https://movie-phinf.pstatic.net/20190318_264/1552894509616f03UM_JPEG/movie_image.jpg,"[3, 1, 4, 12]",2011-10-13,[64],나디아 파르판,"멜빈(Melvin Smiley: 마크 왈버그 분)은 전문적인 살인청부업자. 시스코(Cisco: 루 다이아몬드 필립스 분) 등 4명의 동료들과 함께 일한다. 하지만, 총탄이 터지는 현장에서 항상 제일 위험한 곳에서 애쓰는 사람은 리더인 멜빈 뿐이고 동료들은 한가하게 커피를 마시거나 잡담을 나눈다. 이들은 모두 다른 샐러리맨과 똑같이 보너스를 걱정하고, 정원을 청소하며 퇴근 후 친구들과 한잔의 술로 하루의 긴장을 푸는, 도무지 '고독한 킬러'와는 거리가 먼 킬러들이다.  특히, 멜빈은 모든 사람들에게 잘 보이려고 애쓰는 착하고 따뜻한 성품의 소유자. 그는 자신을 알고 있는 사람들이 자기에 대해서 나쁜 감정을 가지는 것을 도저히 두고 보지 못한다. 때문에 멜빈과 일하는 동료들은 물론 그의 옛 애인과 약혼자까지도 그를 이용해 먹지 못해 안달이다. 보스인 파리스(Paris: 에버리 브룩스 분)의 일감만을 처리해오던 멜빈 일당은 시스코의 주도로 '휴일에는 쉰다'라는 철칙을 깨고, 부업거리를 계획한다. 리더인 멜빈은 처음에는 제안을 거절하지만, 애인의 빚독촉과 약혼자의 성화로 할 수없이 계획에 가담한다. 그들의 한탕(BIG HIT)은 유명한 일본 사업가의 딸 게이코(Keiko Nishi: 차이나 초우 분)를 납치해 1백만달러의 몸값을 받아내는 것이다.  하지만, 일은 바로 꼬이기 시작한다. 게이코의 아버지(Jiro Nishi: 사브 시모노 분)는 이미 파산해 자살하기 일보 직전이었고, 설상가상으로 게이코는 보스 파리스의 대녀였던 것. 보스의 호출을 받은 시스코는 이 모든 일들을 멜빈에게 뒤집어 씌우고 혼자만 위기에서 빠져나온다. 한술 더떠서 '유괴범 처치 작전'의 선두에 나선다. 믿었던 친구의 배신으로 졸지에 쫓기는 신세가 된 멜빈은 보스와 시스코에 맞선다. 정신없는 추격전이 시작되고, 그 와중에도 멜빈과 게이코는 사랑에 빠진다. 옛 애인은 돈을 훔쳐 달아나고, 약혼녀의 못말리는 부모가 찾아오고, 비디오 가게 점원까지 연체된 비디오를 내놓으라고 닥달이다.",
4391,나니아 연대기: 새벽 출정호의 항해,72181,https://movie-phinf.pstatic.net/20111223_154/1324627111792FMs5X_JPEG/movie_image.jpg,"[1, 8, 6]",2010-12-08,"[1744, 2636, 1456, 2637, 2638, 2639]",마이클 앱티드,"페번시가 남매 중 에드먼드와 루시, 그리고 사촌 유스티스는 어느 날, 방에 걸려 있는 그림 속 바다에서 배가 나타나 조금씩 다가오더니 한 순간, 물이 넘쳐 나면서 나니아의 세계로 빨려 들어간다. 실종된 7명의 영주들을 찾아 ‘론 아일랜드’로 가던 캐스피언 일행과 만나 새벽 출정호에 승선, 새로운 모험 길에 오르게 된다. 가장 먼저 도착한 ‘론 아일랜드’. 그곳의 영주인 베른에게서 언제부턴가 정체를 알 수 없는 안개가 피어 오르고, 그 안개 속으로 끌려들어간 배와 사람들은 영영 돌아오지 않는다는 이야기와 함께 아슬란에게서 받은 7개의 마법의 칼을 소지한 7명의 영주가 흩어지면서 힘이 약해져 악의 안개가 피어 오르기 시작했다는 사실을 알게 된다. 위험에 처한 나니아의 운명은 이제 이들 손에 맡겨지고, 5개의 신비한 섬에서 만나는 상상 속 생물들, 사악한 적들과 맞서게 되는데…",
3743,액트 오브 밸러: 최정예 특수부대 ,100611,https://movie-phinf.pstatic.net/20120305_275/1330916008766yCyrn_JPEG/movie_image.jpg,"[3, 12, 17]",2012-02-29,"[2381, 2382, 2383]","마이크 맥코이,스캇 워프","이 영화는 실제사건을 바탕으로 재구성되었다.  그리고 이 영화 속 등장하는 전략과 전술, 무기는 모두 실제다…  납치된 CIA요원 구출작전에 투입된 최정예 특수부대 네이비 실!  작전 중 알게 된 세계를 위협하는 테러집단을 진압하기 위해  최강 전술과 무기를 동원해 목숨을 건 작전을 시작한다.",
1699,쿵푸팬더3,1602030,https://movie-phinf.pstatic.net/20151230_112/1451458570876HklX8_JPEG/movie_image.jpg,"[3, 1, 5, 4, 8]",2016-01-28,"[341, 1432, 802, 1433, 1434, 1435, 1436, 1059, 1393, 1437]","여인영,알레산드로 칼로니","어느 날 우연히 어린 시절 잃어버렸던 진짜 팬더 아버지를 만난 포는 아버지 리와 함께 팬더들이 어울려 사는 비밀스러운 팬더 마을로 향한다. 자신 못지 않게 여유와 흥 넘치는 팬더들과 즐거운 시간을 보내는 포. 하지만 모든 쿵푸 마스터들을 제압하며 전세계를 위협하는 악당 카이의 등장으로 포는 예상치 못했던 불가능한 도전에 맞닥뜨리게 된다. 놀기 좋아하고, 먹는 게 행복이며, 덤벙대는 게 특기인 팬더 친구들에게  궁극의 쿵푸를 전수해야 하는 것.  쿵푸 훈련법 마스터에 나선 포의 팬더 인생 최대의 도전이 시작된다.",
861,살인자의 기억법,1191407,https://movie-phinf.pstatic.net/20171030_272/1509348877448FqDsF_JPEG/movie_image.jpg,"[12, 3, 9, 7]",2017-09-06,"[31, 199, 815, 685]",원신연,"동물병원을 운영하며 딸과 함께 살아가는 병수(설경구)는 한때 연쇄살인범이었다. 어떤 사람들은 죽어 마땅하다고 믿으며, 법의 이름으로 심판하지 못하는 악인들을 자신만의 방식으로 처단하던 병수는 17년 전의 자동차 사고를 계기로 살인을 멈췄다. 사고 후유증으로 알츠하이머병 판정을 받은 그에겐 가까운 기억부터 신호등 움직이듯 깜빡깜빡하다가 어느덧 모든 기억이 사라질 일만 남았다. 그러던 어느 날 병수는 마을에서 태주(김남길)의 차를 들이받는 접촉사고를 낸다. 본능적으로 그가 연쇄살인범임을 직감한 병수는 딸 은희(설현)를 지키기 위해 마지막 살인을 계획한다.",
4231,위험한 상견례,112344,https://movie-phinf.pstatic.net/20150415_257/1429075626914yLhHW_JPEG/movie_image.jpg,"[4, 14]",2011-03-31,"[1269, 1656, 1657, 1658, 1659]",김진영,"‘현지’라는 가명으로 활동하고 있는 순정만화 작가인 전라도 순수 청년 현준. 펜팔에서 만난 경상도 여인 다홍과 알콩달콩 연애하며 사랑을 키워가던 그는 아버지의 강요로 선을 봐야 한다는 다홍의 말에 그녀와 결혼을 결심한다. 하지만 뼛속까지 경상도 남자인 다홍의 아버지로 인해 현준은 전라도 남자임을 감춰야 되는 상황이 벌어지는데…  서울말 특별 과외를 거쳐 압구정남으로 변신한 현준. 드디어 결혼을 승낙 받기 위해 부산에 위치한 다홍의 집으로 향하고, 다홍 가족과 대면한다. 왠지 음침한 다홍의 오빠 운봉을 시작으로 호시탐탐 현준의 흉을 찾으려는 노처녀 고모 영자, 경부선 밖은 나가본 적 없는 우아한 서울 여자인 어머니 춘자, 첫만남에 악수 대신 야구 공을 던지는 초강력 적수 아버지 영광, 거기에 언제 뒤따라 왔는지 현준의 아버지가 스파이로 보낸 형 대식까지.. 과연 현준은 이 모든 난관을 헤치고 다홍과 사랑을 이뤄낼 수 있을까?",
2520,신의 한 수,1183248,https://movie-phinf.pstatic.net/20140603_16/1401760272322q7OHX_JPEG/movie_image.jpg,[3],2014-07-03,"[142, 172, 1898, 369, 1899]",조범구,"프로 바둑기사 태석(정우성)은 내기바둑판에서 살수(이범수)팀의 음모에 의해 형을 잃는다. 심지어 살인 누명을 쓰고 교도소에서 복역하기에 이르고, 몇 년 후 살수와의 대결을 위해 전국의 내로라하는 선수들을 모은다.  각자의 복수와 마지막 한판 승부를 위해 모인 태석(정우성), 주님(안성기), 꽁수(김인권), 허목수(안길강)는 승부수를 띄울 판을 짠다. 단 한번이라도 지면 절대 살려두지 않는 악명 높은 살수(이범수)팀을 향한 계획된 승부가 차례로 시작되고…… 범죄로 인해 곪아버린 내기바둑판에서 꾼들의 명승부가 펼쳐진다.",
4330,시즌 오브 더 위치: 마녀 호송단,213750,https://movie-phinf.pstatic.net/20111223_104/1324629980395CWXXi_JPEG/movie_image.jpg,"[14, 10]",2011-01-13,"[277, 2375]",도미닉 세나,,
517,루비 스팍스,18699,https://movie-phinf.pstatic.net/20180425_102/1524623509141xMu6L_JPEG/movie_image.jpg,"[4, 14, 6, 10]",2018-05-10,"[581, 582]","조나단 데이턴,발레리 페리스","꿈 속에서 만난 이상형 루비를 주인공으로  로맨틱한 소설을 쓰며 상상 연애 중인 천재작가 캘빈.  어느 날, 그에게 너무 사랑스러운 그녀  루비가 소설을 찢고 눈 앞에 나타났다!  널 사랑해도 될까?  캘빈이 상상하고 쓰는 대로 변신하는 루비.  완벽한 그녀와 현실 연애를 시작한 캘빈은  진짜 사랑에 빠질수록 점점 혼란스러워지는데...  우리, 마법일까? 사랑일까?  사랑하고 싶은 당신을 위해 나타난  제작진의 러브픽션",
4123,스크림 4G,30942,https://movie-phinf.pstatic.net/20111223_284/1324639250531l3R14_JPEG/movie_image.jpg,"[13, 7]",2011-06-09,"[481, 2522, 2523, 26, 2500, 542]",웨스 크레이븐,"˝헬로우 시드니?˝  기존의 법칙은 기대도 하지 말 것, 새로운 룰을 적용하라!  작가가 된 시드니(니브 캠벨)는 출판기념 투어의 마지막 일정으로 고향 ‘우즈보로’를 방문하게 된다. 그러나 불행히도 시드니의 귀향은 살인마 ‘고스트 페이스’를 다시 불러들이게 되고, 시드니를 비롯한 옛 친구이자 지금은 결혼한 게일(커트니 콕스)과 듀이(데이빗 아퀘트), 그리고 사촌인 질(엠마 로버츠)과 그녀의 친구들, 나아가 우즈보로 마을 전체가 위험에 빠지게 된다.  더욱 악랄하게 돌아온 정체불명의 살인마 고스트 페이스와 목숨을 건 게임!  살아남기 위해서는 새로운 룰을 적용하라!",
