id,title,audience,poster_url,genres,open_date,actors,director,description,video_key
3775,범죄와의 전쟁: 나쁜놈들 전성시대,1103246,https://movie-phinf.pstatic.net/20111224_165/13246577572754h14b_JPEG/movie_image.jpg,"[9, 12]",2012-02-02,"[427, 263]",윤종빈,"1982년 부산, 해고될 위기에 처한 비리 세관원 최익현은 순찰 중 적발한 히로뽕을 일본으로 밀수출하기 위해 부산 최대 조직의 젊은 보스 최형배와 손을 잡는다. 익현은 탁월한 임기응변과 특유의 친화력으로 형배의 신뢰를 얻는 데 성공한다. 주먹 넘버원 형배와 로비의 신 익현은 함께 힘을 합쳐 부산을 접수하기 시작하고, 나쁜 놈들의 전성시대가 펼쳐진다. 하지만 1990년 범죄와의 전쟁이 선포되자 조직의 의리는 금이 가고 배신이 시작된다. 살아남기 위해 벌이는 치열한 한판 승부, 최후에 웃는 자는 과연 누가 될 것인가?",9bu_FJGpAWU
2547,님포매니악 볼륨1,27505,https://movie-phinf.pstatic.net/20140609_234/14022809519221MYu1_JPEG/movie_image.jpg,"[6, 1, 3, 8, 14]",2014-06-18,"[1923, 1317, 423, 1924]",라스 폰 트리에,"누구도 거부할 수 없고, 누구도 따라갈 수 없는 매력의 강력한 마법을 가진 숲의 수호자 ‘말레피센트’는 인간왕국과의 거대한 전쟁의 소용돌이 속에서 왕국을 다스리는 ‘스테판’ 왕의 딸 ‘오로라’ 공주의 세례식 날, 거부할 수 없는 치명적인 저주를 내리는데...",
72,이스케이프 룸,389570,https://movie-phinf.pstatic.net/20190308_234/1552035128139wsiTd_JPEG/movie_image.jpg,[13],2019-03-14,"[114, 115, 116, 117, 118, 119, 120]",애덤 로비텔,"커플 데이트를 즐기기 위해 LA의 가장 인기 있는 방탈출 카페를 찾은 네 명의 남녀. 그러나 게임 도중 실수로 저주받은 ‘스컬 박스’를 열게 되고, 그로 인해 밀실에 있던 살인마에게 악령이 빙의 되면서 이들의 데이트는 악몽으로 뒤바뀐다. 살아서 이 방을 나갈 수 있는 방법은 오직 단 하나. 제한 시간 60분 안에 살인마의 눈을 피해 유일한 출구를 열 수 있는 단서를 찾아야만 한다.",
2941,섀도우 헌터스: 뼈의 도시,211514,https://movie-phinf.pstatic.net/20130822_135/1377135460109oMh5K_JPEG/movie_image.jpg,"[3, 1, 10, 7, 14, 6]",2013-09-12,"[248, 2088, 2089, 1967, 297, 2090]",해럴드 즈워트,"“모탈잔에 따른 천사의 피를 마신 자! 악마사냥의 운명으로 다시 태어나리라!”  뉴욕의 평범한 소녀 클레리는 어느 날 제이스, 알렉, 이사벨을 만나게 되고, 자신이 그들과 같이 특별한 능력을 가진 섀도우 헌터임을 알게 된다. 뿐만 아니라 발렌타인이 세상을 지배하기 위해 찾고 있는 모탈잔의 행방이 봉인된 클레리의 기억 속에 있다는 비밀이 밝혀지는데…  인간세상과 다운월드, 두 세계를 구하기 위한 그들의 전쟁이 시작된다!",
2637,페이스 오브 러브,46097,https://movie-phinf.pstatic.net/20140410_247/1397122508186zqdrM_JPEG/movie_image.jpg,"[10, 14]",2014-04-16,"[1945, 1700, 1751]",아리 포신,"내 사랑, 내 모든 것……  그날, 내 사랑이 떠났습니다.  그를 잃은 순간, 나도 사라졌습니다.  다시 한번 그를 볼 수 있다면, 만질 수만 있다면..  그런데 오늘,  그의 숨결이 여전히 살아있는 미술관에서 나는 숨이 멎을 것만 같았습니다.  마치 환영처럼 내 사랑을 완벽하게 닮은 남자.  그가 나를 사랑할수록, 내가 이 사람을 원할수록  나는 혼란스러워집니다.  내 사랑은……  5년 전 바닷가에서, 내 심장마저 멈추게 한 그 사람일까요?  내 심장을 다시 뛰게 만든 이 사람일까요?",
1349,아수라,1802691,https://movie-phinf.pstatic.net/20180131_16/1517381229841vD9SI_JPEG/movie_image.jpg,"[3, 9]",2016-09-28,"[1197, 1198, 1199, 1200, 1201, 1202]",팽 장,"강력계 형사 한도경(정우성)은 이권과 성공을 위해 각종 범죄를 저지르는  악덕시장 박성배(황정민)의 뒷일을 처리해주는 대가로 돈을 받는다. 악에 계속 노출되는 사이,  말기 암 환자인 아내의 병원비를 핑계로 돈 되는 건 뭐든 하는 악인의 길로 들어서게 된 한도경.  그의 약점을 쥔 독종 검사 김차인(곽도원)과 검찰 수사관 도창학(정만식)은  그를 협박하고 이용해 박성배의 비리와 범죄 혐의를 캐려 한다.  각자의 이익과 목적을 위해 한도경의 목을 짓누르는 검찰과 박성배.  그 사이 태풍의 눈처럼 되어 버린 한도경은, 자신을 친형처럼 따르는 후배 형사 문선모(주지훈)를  박성배의 수하로 들여보내고, 살아남기 위해 혈안이 된 나쁜 놈들 사이에서 서로 물지 않으면 물리는 지옥도가 펼쳐진다.",
4201,노미오와 줄리엣,78081,https://movie-phinf.pstatic.net/20180907_192/1536282563846MmRwL_JPEG/movie_image.jpg,"[5, 8]",2011-04-14,"[312, 195, 236]",존 스티븐슨,"몬태큐와 캐퓰릿 가문은 담장 하나 사이에 두고 ‘레드 톤’과 ‘블루 톤’의 정원을  경쟁적으로 꾸미며 서로 으르렁대는 사이.  하지만, 진짜 원수는 따로 있었다.  인간들이 외출하거나 잠잘 때만을 기다렸다 움직이기 시작하는  3등신 정원 인형들이 바로 그들.  ‘레드가’와 ‘블루가’로 나뉘어 서로 눈길만 마주쳐도 못 잡아먹어 안달인 이들은  틈만 나면 잔디 깎기 머신에 올라 경주를 한다.  그 중에서도 ‘블루가’의 히어로 노미오와  ‘레드가’의 행동대장 티볼트의 경쟁은  ‘분노의 질주’가 무색할 만큼 손에 땀을 쥐게 하는 명승부다.  그런 이들 사이에도 바야흐로 봄날이 찾아오는데..,  ‘블루가’의 노미오와 ‘레드가’의 줄리엣이  한 눈에 끌려 사랑에 빠지게 된 것.  하지만, 둘의 연애를 축복하는 이들은 아무도 없다.  이제, 노미오와 줄리엣은 인간의 눈만이 아니라 자신들의 친척, 친구의 눈까지 피해가며  밤마다 몰래 데이트를 즐긴다.  그리고 마침내 이 두 가문의 오랜 대립을 종결 지을  비밀 병기 잔디깎기 머신 '테라퍼미네이터'(헐크 호간)가 등장하는데…  과연, 이 중대 국면에 노미오와 줄리엣의 사랑은 어떻게 될까?  과연, 두 가문은 오랜 대립을 멈출 수 있을까?",
2200,킹스맨 : 시크릿 에이전트,713529,https://movie-phinf.pstatic.net/20150211_196/1423620617966V1jPW_JPEG/movie_image.jpg,"[9, 4, 3, 1]",2015-02-11,"[421, 798, 33]",매튜 본,"높은 IQ, 주니어 체조대회 2년 연속 우승!  그러나 학교 중퇴, 해병대 중도 하차.  동네 패싸움에 직장은 가져본 적도 없이 별볼일 없는 루저로 낙인 찍혔던 ‘그’가‘젠틀맨 스파이’로 전격 스카우트 됐다!  전설적 베테랑 요원 해리 하트(콜린 퍼스)는 경찰서에 구치된 에그시(태런 애거튼)를 구제한다.  탁월한 잠재력을 알아본 그는 에그시를 전설적 국제 비밀정보기구 ‘킹스맨’ 면접에 참여시킨다.  아버지 또한 ‘킹스맨’의 촉망 받는 요원이었으나 해리 하트를 살리기 위해 죽었다는 사실을 알게 된 에그시.  목숨을 앗아갈 만큼 위험천만한 훈련을 통과해야 하는 킹스맨 후보들.  최종 멤버 발탁을 눈 앞에 둔 에그시는 최고의 악당 발렌타인(사무엘 L. 잭슨)을 마주하게 되는데…",
4469,레터스 투 줄리엣,168329,https://movie-phinf.pstatic.net/20111223_212/1324623298698EAAYg_JPEG/movie_image.jpg,"[4, 10, 14]",2010-10-06,"[416, 2665, 2666, 2667]",개리 위닉,"작가 지망생 소피는 전세계 여성들이 비밀스런 사랑을 고백하는 ‘줄리엣의 발코니’에서 우연히 50년 전에 쓰여진 러브레터 한 통을 발견하고, 편지 속 안타까운 사연에 답장을 보낸다. 며칠 후, 소피의 눈 앞에 편지 속 주인공 클레어와 그녀의 손자 찰리가 기적처럼 나타나는데…  소피의 편지에 용기를 내어 50년 전 놓쳐버린 첫사랑 찾기에 나선 클레어. 할머니의 첫사랑 찾기가 마음에 안 들지만 어쩔 수없이 따라나선 손자 찰리. 그리고 그들과 동행하게 된 소피. 그들의50년 전 사랑 찾기는 성공할까? 그리고 소피에게는 새로운 사랑이 찾아올까?",
1071,분노의 질주: 더 익스트림,1428592,https://movie-phinf.pstatic.net/20170314_17/1489464877358bXa3j_JPEG/movie_image.jpg,"[3, 9, 12]",2017-04-12,"[954, 480, 326, 439]",F. 게리 그레이,마침내 평화로운 일상으로 돌아온 리더 도미닉(빈 디젤)과 멤버들. 하지만 레티(미셸 로드리게스)와 쿠바에서 신혼을 만끽 중인 도미닉(빈 디젤)에게 불청객이 찾아온다. 전설적인 해커이자 테러 조직의 리더 사이퍼(샤를리즈 테론)는 도미닉을 협박해 자신의 명령을 따르게 한다. 멤버들은 도미닉이 사이퍼와 함께  사상 최악의 테러를 계획하고 있음을 알게 된다.  리더의 배신으로 위기에 놓인 멤버들은 한때 팀을 모두 전멸시키려 했던 데카드 쇼(제이슨 스타뎀)까지 영입해  최악의 적이 되어버린 도미닉과의 피할 수 없는 대결을 앞두게 되는데...,
3907,커플즈,229697,https://movie-phinf.pstatic.net/20111223_239/1324650884710HfXhQ_JPEG/movie_image.jpg,"[4, 14]",2011-11-02,"[482, 1899, 2438, 266, 856]",정용기,"문자 한 통 남기고 사라져버린 여자친구를 수소문하는 유석(김주혁), 떠난 남친이 남긴 A급 큐빅 반지만 손에 쥔 여자 애연(이윤지), 사랑을 찾아 바람처럼 떠도는 여자 나리(이시영), 친구의 친구를 사랑한 자칭 도시의 하이에나 복남(오정세), 그리고 사랑은 절대 없을 거라 믿었던 거친 남자 병찬(공형진) 저마다 특별한 사연을 가진 다섯 싱글이 우연과 필연, 인연과 악연으로 얽히고 설켜드는데...",
893,혹성탈출: 종의 전쟁,1540913,https://movie-phinf.pstatic.net/20170712_250/1499825654939bJBrA_JPEG/movie_image.jpg,"[10, 2, 17]",2017-08-15,"[857, 549, 858, 859]",맷 리브스,"전 세계에 퍼진 치명적인 바이러스인 시미안 플루로 인해 유인원들은 나날이 진화하는 반면, 살아남은 인간들은 점차 지능을 잃고 퇴화해 간다. 멸종 위기에 처한 인간들은 유인원의 리더 시저를 찾아 없애려 하지만, 숲에 머물고 있다는 시저는 몇 년째 은신한 채 모습을 드러내지 않는다. 어느 날 인간 군대의 리더 대령(우디 해럴슨)이 시저의 거처를 급습해 그의 가족을 죽이는 사건이 일어난다. 분노한 시저는 오랫동안 함께해 온 동료 모리스(카린 코노발), 로켓(테리 노터리) 등과 함께 복수의 여정을 떠난다.",
2429,타짜-신의 손,1193816,https://movie-phinf.pstatic.net/20140819_243/1408432915315hGXts_JPEG/movie_image.jpg,"[10, 9]",2014-09-03,"[1852, 1853, 730, 138]",강형철,삼촌 고니의 승부욕과 손재주를 닮은 대길(최승현)은 노름판에서 미나(신세경)를 보고 첫눈에 사랑에 빠지지만 바로 그 다음날 불미스러운 일에 연루되어 동네를 떠나게 된다. 강남의 하우스에 입성하게 된 대길은 타고난 기술과 매력을 활용해 선수로 급성장한다. 배신과 음모가 판을 치는 노름판에서 우 사장(이하늬)을 만나 사랑에 빠지지만 순진했던 그의 마음은 이용만 당한 채 버려진다. 황당한 액수의 채무와 장기 탈취 등으로 노름판 밑바닥까지 내려가게 된 대길은 우연히 고광렬(유해진)을 만나고 노름판의 패가 아닌 노름꾼의 눈을 읽는 기술을 터득하게 되면서 재기의 발판을 다지게 된다.,
1458,BIFAN2016 판타스틱 단편 걸작선 1,21500,https://movie-phinf.pstatic.net/20160725_161/1469438780638RpQvU_JPEG/movie_image.jpg,"[4, 10]", ,[64],,"최고의 전성기를 누리며 부와 명예를 거머쥔 인기 코미디언 하페가 과로로 쓰러지면서 큰 수술을 받게 된다.  수술 후 갖게 된 긴 휴가가 낯설기만 한 그는 곧 무력감에 시달리게 되고 돌연 산티아고 순례길에 오르기로 결심한다.  첫 날부터 폭우와 허름한 숙소, 불면의 밤까지. 하페는 고통이 동행하는 여정을 시작하는데…",
1093,공각기동대 : 고스트 인 더 쉘,569701,https://movie-phinf.pstatic.net/20170323_283/1490247365952HKKGB_JPEG/movie_image.jpg,"[3, 2, 12, 10]",2017-03-29,[5],루퍼트 샌더스,"인공지능 로봇을 신체에 접목해 삶을 연장시키는 사이버 기술이 발달하며 인간과 로봇의 경계가 무너진 가까운 미래, 강력 범죄와 테러 사건을 담당하는 엘리트 특수부대 섹션9. 인간과 인공지능이 결합해 탄생한 특수요원이자 섹션9을 이끄는 메이저(스칼렛 요한슨)는 세계를 위협하는 음모를 지닌 범죄 테러 조직을 저지하라는 임무를 받는다.  첨단 사이버 기술을 보유한 한카 로보틱스를 파괴하려는 범죄 테러 조직을 막기 위해 엘리트 특수부대 섹션9이 나서기 시작하고, 사건을 깊이 파고들수록 메이저는 자신의 과거와 존재에 대한 의문을 갖게 되는데...",
1188,딥워터 호라이즌,68381,https://movie-phinf.pstatic.net/20170102_156/1483339338700qH0kh_JPEG/movie_image.jpg,"[10, 3]",2017-01-25,"[441, 706, 1058, 1059]",피터 버그,"2010년 4월 20일, 미국 루이지애나주 앞바다 멕시코만 석유 시추선 ‘딥워터 호라이즌’ 호. 무리한 작업량으로 인하여 이미 배가 시한폭탄 같은 상태임에도  본사는 일정과 비용을 이유로 안전검사를 무시한다. ‘딥워터 호라이즌’ 호의 총 책임자 ‘지미’(커트 러셀)와 엔지니어 팀장 ‘마이크’(마크 월버그)는 이에 반대하지만,  본사 관리자 ‘돈’(존 말코비치)은 이런 항의를 묵살하고 작업을 강행한다. 본격적인 작업이 시작된 직후, 굴착반 ‘케일럽’(딜런 오브라이언)은 시추관에서 이상 징후를 감지한다. 그리고 그 순간, 배 전체를 뒤흔드는 폭발음과 함께 ‘딥워터 호라이즌’ 호는 거대한 화염에 휩싸이는데...  사상 최악의 해양 재난  참혹한 불길 속, 살아남기 위한 그들의 사투가 시작된다!",
1998,러덜리스,26733,https://movie-phinf.pstatic.net/20150617_37/1434505314610VyfmV_JPEG/movie_image.jpg,"[16, 10, 4]",2015-07-09,"[1267, 1609]",윌리암 H. 머시,"“계속 나아가. 그게 바로 정답이야”  를 이을 진짜 음악 영화가 온다!  잘 나가던 광고 기획자였지만 뜻하지 않은 사고로 과거를 숨긴 채 요트에서 살고 있는 남자 ‘샘’. 어느 날 그는 아마추어 뮤지션들이 즐겨 찾는 클럽에 갔다가 무대에 오른다. 뮤지션이 꿈인 소심한 청년 ‘쿠엔틴’은 ‘샘’의 노래에 반해 함께 밴드를 만들자고 제안한다. 우여곡절 끝에 탄생한 ‘러덜리스’ 밴드, 어울릴 것 같지 않았던 시작이었지만 어디서도 들어본 적 없는 매력적인 노래에 밴드는 점차 인기를 얻는다. 하지만 그들의 곡들이 사실 세상을 떠난 ‘샘’의 아들이 만든 노래라는 비밀이 밝혀지게 되는데….",
2160,살인의뢰,496535,https://movie-phinf.pstatic.net/20150316_127/1426487641594fKOzn_JPEG/movie_image.jpg,"[9, 10, 12]",2015-03-12,"[644, 268, 230]",손용호,"놈을 잡은 날, 내 여동생이 사라졌다.  강력계 촉귀신이자 베테랑 형사인 태수는 어느 날 우연히 뺑소니범 조강천을 잡게 된다. 하지만 단순 뺑소니범이라고 생각했던 조강천의 차에서 수많은 혈흔과 머리카락이 발견되고, 그가 전국을 들썩이게 한 동남부 연쇄실종사건의 범인이라는 사실이 밝혀진다. 범인을 잡고 실종사건이 결국 연쇄 살인사건이라는 것이 드러나며 수사는 급물살을 탄다. 그러던 중 강천의 마지막 범행 대상이 태수의 여동생 수경으로 밝혀져 태수는 충격에 휩싸인다. 태수는 강천에게 수경의 행방을 묻지만, 강천은 찾아보라는 말만 남긴 채 입을 다문다. 그리고 강천에게 아내를 잃은 또 다른 남자 승현은 슬픔과 분노를 견디지 못한 나머지 홀연히 사라져버린다.  그 후로 3년, 조폭 살인사건을 조사하던 태수는 누군가 감옥 안의 강천을 표적으로 하고 있음을 알게 된다. 사형선고를 받은 강천을 죽이려는 자는 도대체 누구인가. 표적이 된 강천을 지킬 수도, 죽일 수도 없는 태수, 그의 앞에 사라졌던 승현이 다시 나타난다.",
1760,스타워즈: 깨어난 포스,1071659,https://movie-phinf.pstatic.net/20160504_22/1462353373485ElbAj_JPEG/movie_image.jpg,"[3, 1, 2, 6]",2015-12-17,[64],,"2번째 데스 스타가 파괴되고 다스 베이더가 사망한 지 약 30년 후,  마지막 남은 제다이인 루크 스카이워커가 사라졌다. 몰락한 은하 제국으로부터 일어난 퍼스트 오더는 루크와 공화국을 찾아내 제거하려 한다. 공화국과 루크의 쌍둥이 여동생 레이아 오르가나가 이끄는 저항군은 퍼스트 오더를 저지하고 루크의 도움을 받기 위해 루크를 찾는다. 저항군 최고의 파일럿 포 다메론은 자쿠 행성의 마을 장로를 만나 루크가 있는 장소의 지도를 얻는다. 카일로 렌이 이끄는 스톰트루퍼들은 마을을 파괴하고 포를 붙잡지만, 포의 드로이드 BB-8는 지도를 갖고 탈출하고 부랑자 레이를 만나게 된다.",G7VijpXyAXI
4012,돈비 어프레이드 : 어둠 속의 속삭임,52910,https://movie-phinf.pstatic.net/20111223_205/1324641835875rDEbp_JPEG/movie_image.jpg,"[6, 13, 12]",2011-08-25,"[1243, 2167]",트로이 닉시,"아빠와 함께 19세기에 지어진 낡은 저택으로 이사 왔다.  어느 날부터,  밤이 되면 알 수 없는 속삭임과 함께  누군가 방에 찾아온다.  이 저택에는 우리 말고 누군가 있다.  이 집에서는 도대체 무슨 일이 있었던 걸까?",
944,플립,134623,https://movie-phinf.pstatic.net/20180622_245/1529632005256Xw7u6_JPEG/movie_image.jpg,"[14, 19]",2017-07-12,[64],배지현,,
1480,레전드 오브 타잔,552146,https://movie-phinf.pstatic.net/20160613_184/1465792678793Nyf8F_JPEG/movie_image.jpg,"[3, 1]",2016-06-29,"[784, 1308, 184, 33, 1309]",데이빗 예이츠,"그레이스토크 백작이자 존 클레이튼 상원의원이 된 타잔(알렉산더 스카스가드)은 밀림의 세계를 그리워하지도, 지금의 삶을 낯설어하지도 않는 차가운 도시인이다. 그는 자신을 타잔이라고 부르는 이에게 자신은 타잔이 아닌 존 클레이튼 3세라고 딱딱하게 말한다. 그가 풀어지는 순간은 아내 제인(마고 로비)과 함께일 때 정도. 한편 정치권에서는 콩고를 식민화하는 과정에서 타잔을 이용하려 한다. 벨기에 왕의 특사 레온 롬(크리스토프 왈츠)은 탐욕을 부리다 위기에 빠지고, 이를 타개하기 위해 타잔을 밀림으로 끌어들일 음모를 꾸민다.",
4223,베니싱,50088,https://movie-phinf.pstatic.net/20160513_236/1463101487492gaU3X_JPEG/movie_image.jpg,"[12, 10, 7]",2011-03-31,[64],"베로니카 블코바,잔 스라멕","제프(키퍼 서덜런드)와 다이앤(산드라 블록)은 완벽한 커플이다. 어느 화창한 날 둘은 휴가 여행을 떠난다. 그런데 고속도로 휴게소에서 다이앤이 실종된다. 정신이 반쯤나간 제프는 백방으로 찾아 보지만 다이앤의 행방은 알 길이 없다. 3년 후 모든 사람이 포기했는데도 제프만은 포기하지 못한다. 그는 리타(낸시 트래비스)와 사랑에 빠졌지만, 리타 몰래 다이앤을 찾는 일을 계속한다. 둘은 그 때문에 가끔 다툰다. 어느날 바니(제프 브릿지스)가 제프를 찾아온다. 바니는 겉보기엔 멀쩡한 화학선생이지만 심각한 정신병자. 다이앤을 유괴해서 살해한 것이 바로 그였던 것이다. 그는 제프에게 진상을 알려면 다이앤과 똑같은 과정을 거쳐야 한다며 제프를 별장으로 끌고가는데...",
574,7년의 밤,418122,https://movie-phinf.pstatic.net/20180314_263/1521014679282NcuID_JPEG/movie_image.jpg,[12],2018-03-28,"[336, 137, 331, 628]",추창민,"인적이 드문 세령마을의 댐 관리팀장으로 부임을 앞둔 ‘최현수’. 가족이 지낼 사택을 보러 가는 날,  안개가 짙게 깔린 세령마을 입구에서 길을 잃고 헤매던 중 갑자기 뛰어나온 여자 아이를 쳐 교통사고를 낸다.  너무 놀란 ‘최현수’는 한 순간의 잘못된 선택으로 호수에 아이를 유기한다. 죽어버린 딸  시작된 복수""어떤 놈이 그랬는지 찾아서... 똑같이 갚아줘야지"" 아이의 실종으로 마을은 발칵 뒤집혀 수색 작업이 시작되고,  결국 싸늘한 주검으로 돌아온 딸을 보자 광기 어린 분노에 사로잡힌, 마을 대지주이자 아이의 아버지 ‘오영제’. 사고가 아니라 사건이라고 판단한 그는 직접 범인을 찾기 위해 증거를 모으기 시작한다. 되돌릴 수 없는 선택,  7년 전 그날 밤, 모든 것이 시작되었다.",
1697,최강전사 미니특공대: 영웅의 탄생,37617,https://movie-phinf.pstatic.net/20160122_89/14534503172789QYza_JPEG/movie_image.jpg,"[8, 5]",2016-02-04,[64],이영준,"마침내 미니특공대 탄생의 비밀이 밝혀진다!  미니특공대의 위대한 탄생!  인간세상을 위협하는 음모에 맞서 싸워라!  시간을 거슬러올라가 미니특공대 탄생의 이야기! 미니특공대 연구소의 제레미 박사는 엄청난 위력의 에너지를 가지고 있는 물질 ‘엘리늄’을 연구하고 있다. 반면, 도마뱀 군단의 대장 제우스는 엘리늄으로 강력한 무기를 만들어 인간세상까지 위협할 계획으로 미니특공대 연구소를 습격해 엘리늄을 빼앗고 만다. 이에 엘리늄 탈환을 위해서 본부는 최정예요원으로 구성된 팀을 만들기로 결정하는데. 각각 다른 지역에서 활약 중이던 볼트와 새미, 맥스, 루시가 한 자리에 모이게 된다! 제레미 박사의 딸 안나와 함께 도마뱀 군단에 맞서는 미니특공대! 하지만 도마뱀 군단의 음모에는 상상도 못할 비밀이 숨겨져 있었는데…",
1473,나우 유 씨 미 2,197969,https://movie-phinf.pstatic.net/20160707_14/1467854366086ApbpC_JPEG/movie_image.jpg,"[3, 4, 12]",2016-07-13,"[1232, 4, 549, 811, 1061]",존 추,"3년 전, 전세계를 무대로 한 통쾌하고 짜릿한  완전범죄 매직쇼로 세계를 발칵 뒤집어 놓은 그들이 돌아왔다!  마술사기단은 더 강력해진 적에 의해 전세계 팬들이 보는 앞에서 함정에 빠지게 되고  세상의 모든 컴퓨터를 컨트롤할 수 있는 카드를 훔쳐야 하는 절체절명의 위기에 빠진다.  불가능한 마술로 명예 회복에 나선 마술사기단!  보고도 믿을 수 없는 완전범죄 매직쇼가 시작된다!",
3763,고스트 라이더 : 복수의 화신,79786,https://movie-phinf.pstatic.net/20120118_110/13268663923675wGxh_JPEG/movie_image.jpg,"[3, 6, 12]",2012-02-16,"[277, 867, 2396, 1569, 2397]","마크 네빌딘,브라이언 테일러","악마 메피스토텔레스에게 영혼을 빼앗기고 기이한 힘을 얻은 자니 블레이즈(니콜라스 케이지). 통제 불가능한 힘을 얻게 된 그는 동유럽 한적한 마을에 숨어 지내고 있다. 그러던 어느 날 수도승 모로가 찾아와 그의 운명을 알려 준다. 악마 로크에게서 세상의 운명을 손에 쥔 소년 대니를 구할 자는 고스트 라이더 밖에 없다는 것. 자신은 영웅이 아니라며 거절하려던 자니는 세상을 구하고 자신의 저주를 풀기 위해 최강의 다크 히어로 고스트 라이더가 되어 악마에겐 응징을, 세상에겐 구원을 선사하기로 마음먹는다!",
2255,패딩턴,194886,https://movie-phinf.pstatic.net/20180122_264/1516602139714eoxVR_JPEG/movie_image.jpg,"[4, 1, 8]",2015-01-07,"[197, 51, 662, 693, 694, 695, 696]",폴 킹,"폭풍우에 가족을 잃은 꼬마곰 ‘패딩턴’은 페루에서 영국까지 ‘나홀로’ 여행을 떠난다. 런던에 도착한 ‘패딩턴’은 우연히 브라운 가족을 만나게 되고 그들의 도움을 받아 새로운 가족을 찾아 나선다! 하지만 움직이기만 해도 사고! 만지기만 해도 사고! 1초에 한번씩 사고를 치는 ‘패딩턴’은 브라운 가족의 골칫거리가 되고 만다. 한편, 말하는 곰이 나타났다는 소식에 악당 박제사 ‘밀리센트’는 호시탐탐 ‘패딩턴’을 노리는데…",
