id,title,audience,poster_url,genres,open_date,actors,director,description,video_key
4382,베리드,45257,https://movie-phinf.pstatic.net/20180111_135/1515656394788eOqju_JPEG/movie_image.jpg,"[10, 12, 7]",2010-12-08,[64],샘 그린,"이라크에서 근무하는 미국인 트럭 운전사 폴 콘로이(라이언 레이놀즈 분). 갑작스런 습격을 받고 눈을 떠보니 그는 어딘가에 묻혀 있다. 직감적으로 그곳이 땅 아래 관 속 임을 안 그. 그에게 주어진 것이라곤 라이터, 칼, 그리고 누구의 것인지 알 수 없는 핸드폰뿐이다. 과연 그는 탈출할 수 있을 것인가?",
3837,셜록홈즈 : 그림자 게임,682647,https://movie-phinf.pstatic.net/20111224_228/1324657680054OtqrY_JPEG/movie_image.jpg,"[1, 3, 9, 7]",2011-12-21,"[1, 35]",가이 리치,"더욱 강렬하게, 더욱 스릴 있게 세상을 구할 홈즈의 추리가 다시 시작된다!  왓슨과 더 많은 시간을 보내기 위해 왓슨의 부인과 경쟁하는 홈즈 앞에 또 한 번 세상에서 가장 명석한 두뇌를 증명할 과제가 주어진다! 셜록 홈즈는 유럽에서 발생하는 연쇄 폭탄 테러사건, 강대국들의 전쟁 위기고조, 미국 철강 왕의 죽음 등 전세계에서 벌어지는 풀리지 않는 사건들이 모두 연결되어 있고 그 배후에 평생의 숙적 모리아티 교수(자레드 해리스)의 더 큰 음모가 숨겨져 있음을 직감한다.  조사 과정에서 만나게 된 집시이자 점술가인 묘령의 프랑스 여인 심(노미 파라스)을 통해 살인사건에 대해 정보를 얻지만 이를 계기로 여인은 킬러의 다음 목표물이 된다. 이에 홈즈는 그녀의 목숨을 구하기 위해, 그녀는 죽음을 피하기 위해 홈즈에게 협조하고 대륙을 넘나드는 험난한 모험 앞에서 교활한 모리아티 교수는 항상 한 발 먼저 죽음의 덫을 놓고 기다린다.  모리아티 교수의 계획이 성공하게 되면 역사가 뒤바뀔 정도로 세상은 위험해진다.  거대한 음모에 맞선 홈즈의 활약이 다시 펼쳐진다!",
4221,내 이름은 칸,109407,https://movie-phinf.pstatic.net/20111223_154/1324634519508BXcx5_JPEG/movie_image.jpg,"[10, 14]",2011-03-24,"[2548, 2549]",카란 조하르,"자폐증을 가지고 있지만 천재적인 지적 능력과 어머니로부터 얻게 된, 세상을 바라보는 순수한 눈을 가진 ‘칸’. 그는 어머니의 죽음 이후 동생이 있는 미국으로 향한다. 칸은 우연히 만난 아름다운 싱글맘 ‘만디라’와 운명적인 사랑에 빠져 결혼을 하게 된다. 하지만, 9.11테러 이후 한 순간 행복은 깨지게 된다. 오해가 낳은 끔찍한 사건으로 모든 것을 잃은 만디라는 모든 원망을 칸에게 돌리게 되고 칸은 그녀와의 약속을 지키기 위해 대통령을 만나기 위한 여정을 시작한다.  과연 그는 대통령을 만날 수 있을까? 그리고 그가 전하려는 말은 무엇일까?",
1127,파도가 지나간 자리,38111,https://movie-phinf.pstatic.net/20170207_77/1486428668482DdNyh_JPEG/movie_image.jpg,"[10, 14]",2017-03-08,"[955, 158, 656]",데릭 시엔프랜스,"1차 세계대전 참전용사였던 ‘톰’(마이클 패스벤더)은 전쟁의 상처로 사람들을 피해 외딴 섬의 등대지기로 자원한다. 그곳에서 만난 ‘이자벨’(알리시아 비칸데르)에게 마음을 열고 오직 둘만의 섬에서 행복한 생활을 시작한다. 하지만 사랑으로 얻게 된 생명을 2번이나 잃게 되고 상심에 빠진다. 슬픔으로 가득했던 어느 날, 파도에 떠내려온 보트 안에서 남자의 시신과 울고 있는 아기를 발견하고 이를 운명으로 받아들이며 완벽한 가정을 이룬다.  그러나 수년 후 친엄마 ‘한나’(레이첼 와이즈)의 존재를 알게 되고, 가혹한 운명에 놓인 세 사람 앞에는 뜻하지 않은 선택이 기다리고 있는데...",
2339,인터스텔라,1905207,https://movie-phinf.pstatic.net/20160530_58/146459304576821oqi_JPEG/movie_image.jpg,"[1, 10, 2]",2014-11-06,"[1784, 1785]",마를린 맥코헨,"세계 각국의 정부와 경제가 완전히 붕괴된 미래가 다가온다. 지난 20세기에 범한 잘못이 전 세계적인 식량 부족을 불러왔고, NASA도 해체되었다. 나사 소속 우주비행사였던 쿠퍼(매튜 매커너헤이)는 지구에 몰아친 식량난으로 옥수수나 키우며 살고 있다. 거센 황사가 몰아친 어느 날 알 수 없는 힘에 이끌려 딸과 함께 도착한 곳은 인류가 이주할 행성을 찾는 나사의 비밀본부. 이 때 시공간에 불가사의한 틈이 열리고, 이 곳을 탐험해 인류를 구해야 하는 임무를 위해 쿠퍼는 만류하는 딸을 뒤로한 채 우주선에 탑승한다.",aLYLNFTV1Ks
902,청년경찰,1948171,https://movie-phinf.pstatic.net/20170814_131/1502673994742txsKh_JPEG/movie_image.jpg,"[4, 3, 7]",2017-08-09,"[838, 747]",김주환,"의욕충만 경찰대생 기준(박서준) X 이론백단 경찰대생 희열(강하늘)  둘도 없는 친구인 두 사람은 외출을 나왔다 우연히 납치 사건을 목격하게 된다.  목격자는 오직 두 사람 뿐! 기준과 희열은 학교에서 배운 대로 지체 없이 경찰에 신고한다.  하지만 복잡한 절차와 부족한 증거로 수사는 전혀 진행될 기미가 보이지 않는 상황!  1분 1초가 급박한 상황에서 아까운 시간만 흘러가자,  기준과 희열은 직접 발로 뛰는 수사에 나서기로 하고  예측 불가능한 상황을 마주하게 되는데…  전공지식 총동원! 파릇파릇한 놈들의 혈기왕성 실전수사가 시작된다!",
2208,7번째 아들,74742,https://movie-phinf.pstatic.net/20150128_237/1422406683737QR0BG_JPEG/movie_image.jpg,"[1, 6]",2015-02-11,"[586, 1744, 669]",세르게이 보드로프,"100년만에 전설 속 붉은 달이 뜨고 대마녀 멀킨(줄리안 무어)과 어둠의 존재들이 되살아나면서 세상은 멸망의 위기에 빠진다. 한편, ‘7번째 아들의 7번째 아들’ 톰(벤 반스)은 매일 밤 꿈에 나타나던 남자 그레고리(제프 브리지스)와 만나게 되고 그는 톰만이 세상을 구할 유일한 희망이라며 자신과 함께 절대 악과 맞서 싸워야 한다고 하는데…",
1380,"고산자, 대동여지도",300540,https://movie-phinf.pstatic.net/20160830_267/1472533825556VNMmB_JPEG/movie_image.jpg,"[15, 10]",2016-09-07,"[1226, 1227]",강우석,"지도가 곧 권력이자 목숨이었던 시대,  조선의 진짜 지도를 만들기 위해 두 발로 전국 팔도를 누빈 고산자(古山子) 김정호.  하나뿐인 딸 순실이 어느 새 열여섯 나이가 되는지도 잊은 채  지도에 미친 사람이라는 손가락질에도 아랑곳 않고 오로지 지도에 몰두한다.  나라가 독점한 지도를 백성들과 나누고자 하는 일념 하나로  대동여지도의 완성과 목판 제작에 혼신을 다하는 김정호.  하지만 안동 김씨 문중과 대립각을 세우던 흥선 대원군은  김정호의 대동여지도를 손에 넣어 권력을 장악하려고 하는데...",
616,나미야 잡화점의 기적,157331,https://movie-phinf.pstatic.net/20180306_240/1520323527034cryNh_JPEG/movie_image.jpg,"[6, 10]",2018-02-28,"[673, 674, 675, 676]",히로키 류이치,"어느 날 몸을 피해 잡화점에 숨어 들어온 3인조 좀도둑은 우연히 우체통을 통해 편지를 받게 된다. 장난스레 편지에 답장을 하던 이들은 그 편지가 과거에서 보낸 편지라는 사실을 알게 되는데… 첫 번째 편지, 가수의 꿈을 이루기 위해 도시로 나갔지만 가수로서 재능이 보이지 않아 고민하는 ‘시골 뮤지션’이 보내는 편지. 두 번째 편지, 마이클 잭슨 같은 스타를 꿈꾸지만 아버지의 사업 실패와 순간의 실수 때문에 가족과 헤어져 보육원에서 자라난 ‘하오보’가 보내는 편지. 세 번째 편지, 가족을 부양하기 위해 큰돈을 벌고 싶은 ‘길 잃은 강아지’가 보내는 편지. 아무에게도 말하지 못했던 모두의 고민이 모여드는 “나미야 잡화점” 하룻밤 동안 펼쳐지는 가슴 따뜻한 이야기가 당신을 찾아갑니다.",uSkk5kf9jzQ
4120,화이트: 저주의 멜로디,214360,https://movie-phinf.pstatic.net/20111223_63/132463825451133bmN_JPEG/movie_image.jpg,"[13, 10, 16]",2011-06-09,"[850, 99, 2506, 2507, 1269]","김곡,김선","인기 아이돌에 밀려, 빛도 제대로 못 본 걸그룹 핑크돌즈는  주인 없는 곡 ‘화이트’를 리메이크한 2집으로 최고의 인기를 얻게 된다.  백댄서 출신으로 노장 취급 받는 리더 은주,  고음처리가 불안한 보컬 제니,  성형 중독, 얼굴마담 아랑,  랩, 댄스 실력만 출중한 신지  핑크돌즈가 최고의 주가를 올릴수록 이들의 시기와 질투는 심해지고  메인보컬에 대한 경쟁은 더욱 치열해진다.  그러나,  ‘화이트’의 메인보컬이 되는 멤버마다 차례로 끔찍한 사고를 겪게 되고,  은주는 ‘화이트’라는 노래에 잔혹한 저주가 걸려있음을 직감하고 그 비밀을 파헤치려 하는데…",
4245,월드 인베이젼,522475,https://movie-phinf.pstatic.net/20111223_202/1324633040929An8FT_JPEG/movie_image.jpg,"[3, 2]",2011-03-10,"[1204, 1674, 2565, 2566]",조나단 리브스만,"지금, 전세계가 공격 받고 있다! 1942년 LA UFO 대공습 사건 이래 지난 수십년간 UFO 목격 사례는 전세계 각지에서 꾸준하게 보고되어 왔다. 2011년, 거대한 유성 떼가 지구에 떨어지고, 사상 최대의 유성쇼에 들떠있던 세계 각 도시는 정체불명의 적으로부터 무차별 공격을 받고 초토화된다. LA 주둔군 소속 낸츠 하사(아론 에크하트)는 자신의 부대를 이끌고 지금껏 싸워본 적 없는 적들에 맞서 사상 최대의 반격 임무를 맡아 전면전에 참가하게 되는데…  3월 10일, 인류의 운명을 건 반격이 시작된다!",
2612,리오 2,251095,https://movie-phinf.pstatic.net/20170418_138/1492503302910sL7gD_JPEG/movie_image.jpg,"[1, 4, 8, 5]",2014-05-01,[64],진도 마사아키,"야생을 한 번도 겪어보지 못한 도시형 앵무새 ‘블루’는 자신과 정반대의 매력을 지닌 ‘쥬엘’을 만나 개구쟁이 세 아이를 낳고 평화로운 생활을 이어간다. 그러던 어느 날 아마존에서 자신들의 동족인 파란 마코 앵무새들이 발견됐다는 소식을 접하게 되고, 아내 ‘쥬엘’의 설득에 못 이겨 도심에서 3,200km 떨어진 아마존으로 모험을 떠난다. 야생 라이프에 완벽 적응한 ‘쥬엘’과 세 아이들과는 달리 도시생활에 길들여진 ‘블루’는 깃털 나고 처음으로 가 본 아마존 정글이 불편하기만 하다. 설상가상 ‘블루’에게 두 날개를 빼앗긴 악당 앵무새 ‘나이젤’이 복수를 위해 드림팀을 꾸려 ‘블루’의 뒤를 바짝 쫓고, 어둠의 세력까지 가세해 아마존 정글과 ‘블루’ 가족을 위협하고 나서는데…",
3911,헬프,58029,https://movie-phinf.pstatic.net/20180719_28/1531962768806HN356_JPEG/movie_image.jpg,"[4, 10, 16]",2011-11-03,[64],레이하네 카보쉬,"스코틀랜드 글래스고를 배경으로 한 빈티지 주크박스 필름. 위태로운 방황의 시기를 겪던 소녀 이브는 우연히 새로운 친구들을 만나 우정과 사랑을 나눈다. 그 시간들을 통해 자신이 정말 원하고, 잘하는 것이 음악이라는 것을 깨닫게 된 이브. 하지만 어느 날 뜻밖의 위기가 찾아오는데... 찬란했던 그 여름의 기억은 어디로 갔을까?",
3674,하트 브레이커,30392,https://movie-phinf.pstatic.net/20120323_170/133248325816983OEJ_JPEG/movie_image.jpg,[10],2012-04-19,"[2367, 2368]",파스칼 쇼메유,"독재정권에 맞서 민주주의를 열망하며 대통령을 꿈꾸던 한 정치가와, 그의 뒤에서 천재적인 전략으로 선거판을 뒤집으며 '선거의 귀재'로 불렸던 한 남자가 파란만장한 1960~1970년대를 관통하며 겪는 뜨거운 드라마",
1619,배트맨 대 슈퍼맨: 저스티스의 시작,1386658,https://movie-phinf.pstatic.net/20160318_192/1458281933154QBCXn_JPEG/movie_image.jpg,"[3, 1, 6]",2016-03-24,"[435, 764, 1390, 475, 1232, 1064, 457, 765, 442, 589]",잭 스나이더,슈퍼맨과 조드 장군의 격렬한 전투 이후 메트로폴리스는 파괴되었고 슈퍼맨은 세계 최고 논쟁의 인물이 되어 버린다. 검증되지 않은 신과 같은 능력을 지닌 슈퍼맨의 등장에 사람들은 두려움에 빠지게 된다. 한편 배트맨은 그 동안 타락했던 많은 자들처럼 슈퍼맨 역시 언젠가 타락을 할 것이라 생각하며 사회에서 가장 위험한 존재로 여긴다. 세계의 미래를 위해 무모하고 제어할 수 없는 힘을 가진 슈퍼맨으로 인해 벌어졌던 일들을 바로 잡으려 한다. 배트맨과 슈퍼맨이 격돌하는 사이 인류를 위협할 새로운 위기가 빠르게 부상하기 시작하는데...,6e3HL75yZz0
2558,베스트 오퍼,23169,https://movie-phinf.pstatic.net/20140513_194/1399968132974z9b1s_JPEG/movie_image.jpg,"[10, 14, 9, 7]",2014-06-12,"[929, 323, 780, 1926]",쥬세페 토르나토레,최고가로 미술품을 낙찰시키는 세기의 경매사이자 예술품의 가치를 알아보는 완벽한 감정인 올드먼(제프리 러쉬). 고저택에 은둔한 여인으로부터 감정 의뢰를 받으면서 예상치 못한 인생의 변화를 맞이하게 되는데…,
625,셰이프 오브 워터: 사랑의 모양,162560,https://movie-phinf.pstatic.net/20180307_227/15203992433853TIaa_JPEG/movie_image.jpg,"[10, 6, 14]",2018-02-22,"[659, 660, 661, 38, 662, 663]",기예르모 델 토로,"우주 개발 경쟁이 한창인 1960년대, 미 항공우주 연구센터의 비밀 실험실에서 일하는 언어장애를 지닌 청소부 엘라이자(샐리 호킨스)의 곁에는 수다스럽지만 믿음직한 동료 젤다(옥타비아 스펜서)와 서로를 보살펴주는 가난한 이웃집 화가 자일스(리차드 젠킨스)가 있다. 어느 날 실험실에 온몸이 비늘로 덮인 괴생명체가 수조에 갇힌 채 들어오고, 엘라이자는 신비로운 그에게 이끌려 조금씩 다가가게 된다. 음악을 함께 들으며 서로 교감하는 모습을 목격한 호프스테틀러 박사(마이클 스털버그)는 생명체에게 지능 및 공감 능력이 있다는 사실을 알게 되는데...",
831,킹스맨: 골든 서클,2350671,https://movie-phinf.pstatic.net/20171016_232/1508134137061ayymY_JPEG/movie_image.jpg,"[3, 1, 4]",2017-09-27,"[798, 586, 421]",매튜 본,"철저하게 비밀에 둘러싸인 채 세상을 안전하게 지키는 임무를 수행해온 독자적인 국제 정보 조직 킹스맨. 그러나 어느 날 국제적 범죄조직 골든 서클에 의해 킹스맨 본부가 무참히 파괴된다. 에그시(태런 에저튼)와 멀린(마크 스트롱)은 킹스맨 ‘최후의 날’ 규약에 따라 발견된 위스키 병에서 ‘미국 켄터키’라는 키워드를 얻게 되고, 그 곳에서 형제 조직인 스테이츠맨의 존재를 알게 된다. 전 세계를 장악하기 위해 위협적인 비지니스를 추진 중인 골든 서클과 수장 포피(줄리안 무어). 이들의 계획을 막기 위한 킹스맨과 스테이츠맨의 작전이 시작된다.",
3406,용의자X,634282,https://movie-phinf.pstatic.net/20180411_99/1523430085223y8oKC_JPEG/movie_image.jpg,"[7, 12]",2012-10-18,"[2006, 2007, 2008]",소유붕,"어느 날 처참하게 불에 타버린 사체가 발견된다. 주변 증거를 토대로 사체의 신원이 밝혀지고 유력한 용의자로 그의 전처 ‘천칭’이 지목된다. 하지만 그녀의 완벽한 알리바이는 수사를 미궁에 빠뜨리고, 경찰은 경찰학교 부교수이자 공안국 고문 위원인 ‘탕촨’에게 도움을 요청한다. 사건을 조사하던 탕촨은 그녀의 완벽한 알리바이 뒤에 수학 천재이자 자신의 옛 친구였던 ‘스홍’이 있었음을 직감한다. 그리고 사라진 진실을 사이에 둔 두 천재 수학자의 숨막히는 두뇌 게임이 시작되는데…",
782,부라더,731562,https://movie-phinf.pstatic.net/20181129_255/1543452505700tFbVC_JPEG/movie_image.jpg,[4],2017-11-02,"[309, 140, 138]",장유정,"인디아나 존스를 꿈꾸며 유물발굴에 전 재산을 올인 하지만  현실은 늘어나는 빚과 쓸모 없는 장비뿐인 형 석봉(마동석)  가문을 대표하는 눈부신 외모와 명석한 두뇌로 잘 나가는 건설 회사에 다니지만  순간의 실수로 실직 위기에 처한 동생 주봉(이동휘)  3년 만에 본가로 강제소환(?) 당한 형제는 사고로 오로라(이하늬)를 치게 된다.  이제 그들이 움직이기 시작한다!  사고 탓인지 원래 그런 건지,  알 수 없는 말과 돌발 행동으로 형제를 헉(!)하게 만드는 멘탈까지 묘(?)한 여자 오로라  형제의 인생에 훅 들어온 그녀는 그들에게 엄청난 비밀을 알려주게 되고  오로라의 말에 혹한 석봉과 주봉에게 지긋지긋한 안동은 노다지로 보이기 시작 하는데…",
2097,스틸 앨리스,37655,https://movie-phinf.pstatic.net/20150424_218/1429839405863djz5d_JPEG/movie_image.jpg,[10],2015-04-29,"[1233, 586, 1650, 888]","리처드 글랫저,워시 웨스트모어랜드","세 아이의 엄마, 사랑스러운 아내, 존경 받는 교수로서 행복한 삶을 살던 ‘앨리스(줄리안 무어)’. 어느 날 자신이 희귀성 알츠하이머에 걸렸다는 사실을 알게 된다. 행복했던 추억, 사랑하는 사람들까지도 모두 잊어버릴 수 있다는 사실에 두려움을 느끼는 앨리스. 하지만 소중한 시간들 앞에 온전한 자신으로 남기 위해 당당히 삶에 맞서기로 결심하는데…",
1798,크림슨 피크,31888,https://movie-phinf.pstatic.net/20151125_74/144842898744842umV_JPEG/movie_image.jpg,"[10, 6, 13, 7, 14, 12]",2015-11-25,"[833, 1002, 579, 1228]",기예르모 델 토로,"유령을 볼 수 있는 능력을 가진 소설가 이디스가 남편 토마스의 집인 '크림슨 피크'에 살게 되면서 겪게 된 일을 그리고 있는 영화로, 델 토로 감독이 오랜만에 장기를 발휘한 고딕양식의 호러 판타지 영화. 델 토로가 연출뿐만 아니라 각본, 제작까지 담당한 작품으로 《판의 미로》처럼 그의 장기를 백분 발휘한 작품이다.",mU20xVCPi2o
2827,이스케이프 플랜,133194,https://movie-phinf.pstatic.net/20181105_295/1541397453812SGGlg_JPEG/movie_image.jpg,"[3, 12]",2013-12-05,"[1885, 490, 2037]",스티븐 C. 밀러,,
4208,써커 펀치,113652,https://movie-phinf.pstatic.net/20111223_42/1324634433507JujJz_JPEG/movie_image.jpg,"[3, 6, 12]",2011-04-07,"[1983, 779, 2041, 2402, 2481, 1010, 2560]",잭 스나이더,"미래전사들의 액션펀치 (써커펀치) | 300 감독의 거대한 미래전쟁, 가상현실 속 최강의 적을 무찔러라!  자유를 위한 기습공격! 다섯 개의 아이템을 찾아라! TEST MISSION_세 명의 거대한 무사들을 무찔러라! MISSION CHALLENGE1 지도(map)_나치군단을 제거하라! MISSION CHALLENGE2 불(fire)_용사들과 드래곤을 섬멸하라! MISSION CHALLENGE3 칼(knife)_사이보그 전사들을 격파하라! MISSION CHALLENGE4 열쇠(key)_무자비한 적의 광란에 맞서라! LAST CHALLENGE_네 안의 모든 능력을 깨워라! 탈출하라! 네 마음이 널 자유케 하리라!",
4402,더 콘서트,55658,https://movie-phinf.pstatic.net/20150605_238/14334876180566mdkt_JPEG/movie_image.jpg,"[10, 4]",2010-11-25,[2648],,"30년 전, 유대인을 숨겨줬단 이유로 볼쇼이 교향악단에서 지휘자 자리를 박탈당한 안드레이. 그는 복귀의 그날 만을 꿈꾸며 볼쇼이 극장에서 말단 청소부로 버티고 있다. 그러던 어느날, 볼쇼이에 파리의 극장에서 초청공문이 날라오고 공문을 몰래 가로챈 안드레이는 절친한 친구 샤샤와 함께 30년 전 못다한 공연의 설욕무대를 몰래 준비하려 하는데...",
1261,미씽: 사라진 여자,706271,https://movie-phinf.pstatic.net/20161130_126/1480469003419ruzKF_JPEG/movie_image.jpg,"[10, 7, 12]",2016-11-30,"[200, 204]",이언희,"이혼 후 육아와 생계를 혼자 책임져야 하는 워킹맘 지선은 헌신적으로 딸을 돌봐주는  보모 한매가 있어 늘 다행이라고 생각한다. 어느 날, 퇴근 후 집에 돌아온 지선은 보모 한매와 딸 다은이가 흔적도 없이 사라져 버린 것을 알게 된다. 지선은 뒤늦게 경찰과 가족에게 사실을 알리지만 아무도 그녀의 말을 믿지 않고, 오히려 양육권 소송 중 일으킨 자작극으로 의심한다.  결국 홀로 한매의 흔적을 추적하던 지선은 집 앞을 서성이는 정체불명의 남자와 주변 사람들의 이상한 증언들로 더욱 혼란에 빠지게 되고,  그녀의 실체에 가까워질수록 이름, 나이, 출신 등 모든 것이 거짓이었다는 충격적인 진실을 알게 되는데...",wRQZFt70JvY
1103,보통사람,255227,https://movie-phinf.pstatic.net/20170228_155/1488245330101ewBDc_JPEG/movie_image.jpg,"[9, 3, 10]",2017-03-23,"[997, 998]",김봉한,"열심히 범인 잡아 국가에 충성하는 강력계 형사이자 사랑하는 아내(라미란),  아들과 함께 2층 양옥집에서 번듯하게 살아보는 것이 소원인 평범한 가장 성진(손현주).  그날도 불철주야 범인 검거에 나섰던 성진은 우연히 검거한 수상한 용의자 태성(조달환)이  대한민국 최초의 연쇄살인범일 수도 있다는 정황을 포착하게 되고,  이로 인해 안기부 실장 규남(장혁)이 주도하는 은밀한 공작에 자신도 모르는 사이 깊숙이 가담하게 된다.  한편, 성진과는 가족과도 같은 막역한 사이인 자유일보 기자 재진(김상호)은  취재 중 이 사건의 수상한 낌새를 눈치채고 성진에게 이쯤에서 손을 떼는 것이 좋겠다고 말하지만,  다리가 불편한 아들의 수술을 약속 받은 성진은 규남의 불편한 제안을 받아들이고 만다.  아버지로서 할 수 밖에 없었던 선택,  이것이 도리어 성진과 가족들을 더욱 위험에 빠트리고 그의 삶을 송두리째 흔들기 시작하는데…",
556,"그날, 바다",178265,https://movie-phinf.pstatic.net/20180409_216/1523237427824JU3OT_JPEG/movie_image.jpg,[11],2018-04-12,[142],김지영,"2014년 4월 16일, 세월호가 침몰했다. 8시 30분경과 8시 50분경으로 사고 발생 시간에 대한 진술은 엇갈리고,  세월호의 항로를 기록한 데이터는 각기 다르게 기록되거나 사라졌다.  과학적인 분석과 자료 수집, 4년간의 치밀한 조사로 오직 팩트로만 아직 아무것도 밝혀지지 않은 그날을 추적한다.  잊을 수 없는 '그날', 모든 걸 알고 있는 '바다'  증거에 증거로 답해야 할 것이다!",
2884,톱스타,117844,https://movie-phinf.pstatic.net/20150825_70/1440480552595ER66e_JPEG/movie_image.jpg,[10],2013-10-24,"[2071, 2072, 2073, 2074, 2075]",노병하,"성실하고 우직한 매니저 태식(엄태웅). 그의 꿈은 스타를 빛나게 만드는 사람이 아닌 스타, 그리고 배우였다. 그에게 어느 날 한줄기 빛과 같은 기회가 찾아온다.  태식의 우상이자 대한민국 최고의 톱스타인 원준(김민준)이 실수로 음주운전 뺑소니 사고를 일으킨 것. 태식은 원준을 대신해 거짓 자수를 하고, 원준은 보답으로 자신이 주인공인 드라마의 작은 배역을 따게 해준다.  그토록 간절히 바라왔던 배우의 꿈을 이루게 된 태식. 하지만 높은 곳으로 올라갈 수록 태식의 욕망은 점점 커져만 간다. 태식은 이제 원준의 자리를 위협하는 톱스타가 되었고, 수 년을 바라만보던 원준의 애인이자 드라마 제작자인 미나(소이현)까지 욕심 낸다. 원준은 자신의 비밀까지 폭로하며 톱스타 자리에 집착하는 태식을 자신만의 방식으로 저지하려고 한다.",
